Key,ShortKey,Source,Row,Module,Field,Character,CN,EN
AvgCommunicate_57919_Content_4,abBn,avg通讯器聊天表_AvgCommunicate_A_M.csv,283,AvgCommunicate,Content,玩家,水啊……海边怎么样？我正好今天休息。,A place with water..? How about the beach? I'm free today.
AvgCommunicate_57919_Content_5,abBo,avg通讯器聊天表_AvgCommunicate_A_M.csv,284,AvgCommunicate,Content,奥瑞塔,好耶好耶，那我能不能叫上詹金他们？,"Great! Oh, but can I invite Jenkin and the others too?"
AvgCommunicate_57919_Option_6,abBw,avg通讯器聊天表_AvgCommunicate_A_M.csv,285,AvgCommunicate,Option,玩家,可以呀，一会儿在校门口见。,Go ahead. Let's meet at the school gate later.
AvgCommunicate_57919_Content_6,abBp,avg通讯器聊天表_AvgCommunicate_A_M.csv,285,AvgCommunicate,Content,玩家,可以呀，一会儿在校门口见。,Go ahead. Let's meet at the school gate later.
AvgCommunicate_57919_Content_7,abBq,avg通讯器聊天表_AvgCommunicate_A_M.csv,286,AvgCommunicate,Content,奥瑞塔,好的！海边海边——出发——,"Alright! The beach~, the beach~, let's go—!"
AvgCommunicate_57914_Content_1,abyE,avg通讯器聊天表_AvgCommunicate_A_M.csv,292,AvgCommunicate,Content,墨菲（唤醒体）,真是气人！,How frustrating!
AvgCommunicate_57914_Option_2,abzk,avg通讯器聊天表_AvgCommunicate_A_M.csv,293,AvgCommunicate,Option,玩家,怎么了？,What's wrong?
AvgCommunicate_57914_Content_2,abyP,avg通讯器聊天表_AvgCommunicate_A_M.csv,293,AvgCommunicate,Content,玩家,怎么了？,What's wrong?
AvgCommunicate_57914_Content_3,abyS,avg通讯器聊天表_AvgCommunicate_A_M.csv,294,AvgCommunicate,Content,墨菲（唤醒体）,我明明已经提前半个小时去排队了，半个小时，为什么轮到我的时候小蛋糕还是没了啊？,"I stood in line for over 30 minutes, yet the cupcakes I wanted had already sold out before I got to the front!"
AvgCommunicate_57914_Content_4,abyT,avg通讯器聊天表_AvgCommunicate_A_M.csv,295,AvgCommunicate,Content,墨菲（唤醒体）,这学校里就这么多一大早搬凳子过去排的闲人吗？,Are there really so many people in this school with nothing better to do than to line up so early in the morning?!
AvgCommunicate_57914_Option_5,abzp,avg通讯器聊天表_AvgCommunicate_A_M.csv,296,AvgCommunicate,Option,玩家,其实……,Well...
AvgCommunicate_57914_Content_5,abyU,avg通讯器聊天表_AvgCommunicate_A_M.csv,296,AvgCommunicate,Content,玩家,其实……,Well...
AvgCommunicate_57914_Content_6,abyV,avg通讯器聊天表_AvgCommunicate_A_M.csv,297,AvgCommunicate,Content,墨菲（唤醒体）,……你这反应什么意思。,"...What do you mean, ""well...""?"
AvgCommunicate_57914_Content_7,abyW,avg通讯器聊天表_AvgCommunicate_A_M.csv,298,AvgCommunicate,Content,墨菲（唤醒体）,难道说你买到了？！,Wait a minute... Did you ACTUALLY BUY IT?!
AvgCommunicate_57914_Option_8,abzs,avg通讯器聊天表_AvgCommunicate_A_M.csv,299,AvgCommunicate,Option,玩家,那还用说？排了我好久。,Guess you could say I also waited in line for a while...
AvgCommunicate_57914_Content_8,abyX,avg通讯器聊天表_AvgCommunicate_A_M.csv,299,AvgCommunicate,Content,玩家,那还用说？排了我好久。,Guess you could say I also waited in line for a while...
AvgCommunicate_57914_Option_9,abzt,avg通讯器聊天表_AvgCommunicate_A_M.csv,300,AvgCommunicate,Option,玩家,我就是一大早搬凳子去排队的闲人。,I too am someone with nothing better to do then stand in a line early in the morning...
AvgCommunicate_57914_Content_9,abyY,avg通讯器聊天表_AvgCommunicate_A_M.csv,300,AvgCommunicate,Content,玩家,我就是一大早搬凳子去排队的闲人。,I too am someone with nothing better to do then stand in a line early in the morning...
AvgCommunicate_57914_Content_12,abyH,avg通讯器聊天表_AvgCommunicate_A_M.csv,303,AvgCommunicate,Content,墨菲（唤醒体）,你在队头买走整整一打小蛋糕的时候，一定没想到我就在队尾看着吧。,"When you bought a whole dozen cupcakes, I bet you weren't expecting me to be watching from the back, did you?"
AvgCommunicate_57914_Content_13,abyI,avg通讯器聊天表_AvgCommunicate_A_M.csv,304,AvgCommunicate,Content,墨菲（唤醒体）,现在，快把蛋糕送到我寝室来！不然我就把你翘课的事情告诉——,Now send those cupcakes to my dorm! Or I'll tell your teachers about the classes you skip—
AvgCommunicate_57914_Content_16,abyL,avg通讯器聊天表_AvgCommunicate_A_M.csv,307,AvgCommunicate,Content,墨菲（唤醒体）,刚刚有人敲门，给我送来了小蛋糕。,Someone just left some cupcakes at my door.
AvgCommunicate_57914_Option_18,abzi,avg通讯器聊天表_AvgCommunicate_A_M.csv,309,AvgCommunicate,Option,玩家,是个惊喜哦。,Surprise.
AvgCommunicate_57914_Content_18,abyN,avg通讯器聊天表_AvgCommunicate_A_M.csv,309,AvgCommunicate,Content,玩家,是个惊喜哦。,Surprise.
AvgCommunicate_57914_Content_19,abyO,avg通讯器聊天表_AvgCommunicate_A_M.csv,310,AvgCommunicate,Content,墨菲（唤醒体）,耍小聪明的家伙……好吧，既然这样，我就帮你保守秘密吧。,"Smartass... Fine, I won't tell anyone about what you did this morning."
AvgCommunicate_57914_Content_20,abyQ,avg通讯器聊天表_AvgCommunicate_A_M.csv,311,AvgCommunicate,Content,墨菲（唤醒体）,不过你买得也太多了吧，我一个人怎么吃的完？快过来陪我吃，我会准备好茶的。,"But you've bought so much! How could I possibly eat all of it? Come, join me. I'll even prepare some tea."
AvgCommunicate_57959_Content_2,abCR,avg通讯器聊天表_AvgCommunicate_A_M.csv,314,AvgCommunicate,Content,玩家,你怎么也有一个通讯器？,"First off, my name isn't ""Hey."" Where did you get a communicator?!"
AvgCommunicate_57959_Option_3,abDd,avg通讯器聊天表_AvgCommunicate_A_M.csv,315,AvgCommunicate,Option,玩家,其次，你怎么也有一个通讯器？,"Don't just casually say ""Hey.""!"
AvgCommunicate_57959_Content_3,abCS,avg通讯器聊天表_AvgCommunicate_A_M.csv,315,AvgCommunicate,Content,玩家,你怎么也有一个通讯器？,"Don't just casually say ""Hey.""! Where did you get a communicator from?!"
AvgCommunicate_57959_Content_4,abCT,avg通讯器聊天表_AvgCommunicate_A_M.csv,316,AvgCommunicate,Content,戈利亚,弥萨格可不是唯一掌握了银芯技术的势力。,Mythag aren't the only ones who have mastered Silver Core tech.
AvgCommunicate_57959_Option_5,abDf,avg通讯器聊天表_AvgCommunicate_A_M.csv,317,AvgCommunicate,Option,玩家,你想说什么？,What do you want?
AvgCommunicate_57959_Content_5,abCU,avg通讯器聊天表_AvgCommunicate_A_M.csv,317,AvgCommunicate,Content,玩家,所以你想说什么？我不认为你找我就是为了炫耀自己的通讯器的。,What do you want? I doubt you messaged me just to show off your communicator.
AvgCommunicate_57959_Content_6,abCV,avg通讯器聊天表_AvgCommunicate_A_M.csv,318,AvgCommunicate,Content,戈利亚,还算聪明。,"Clever, aren't you?"
AvgCommunicate_57959_Option_8,abDi,avg通讯器聊天表_AvgCommunicate_A_M.csv,320,AvgCommunicate,Option,玩家,……你有什么事要在警局找我？,...Why do you need me at a police station?
AvgCommunicate_57959_Content_8,abCX,avg通讯器聊天表_AvgCommunicate_A_M.csv,320,AvgCommunicate,Content,玩家,……你有什么事要在警局找我？,...Why do you need me at a police station?
AvgCommunicate_57959_Content_9,abCY,avg通讯器聊天表_AvgCommunicate_A_M.csv,321,AvgCommunicate,Content,玩家,不会是被抓了吧。,Were you arrested or something?
AvgCommunicate_57959_Content_10,abCP,avg通讯器聊天表_AvgCommunicate_A_M.csv,322,AvgCommunicate,Content,戈利亚,孱弱的人类怎么可能抓得住我？,How could puny humans possibly arrest me?
AvgCommunicate_57959_Content_11,abCQ,avg通讯器聊天表_AvgCommunicate_A_M.csv,323,AvgCommunicate,Content,戈利亚,算了，我自己解决。,Forget it. I'll take care of it myself.
AvgCommunicate_57958_Option_3,abCH,avg通讯器聊天表_AvgCommunicate_A_M.csv,326,AvgCommunicate,Option,玩家,学点好的吧,Please don't imitate charlatans...
AvgCommunicate_57958_Content_3,abCu,avg通讯器聊天表_AvgCommunicate_A_M.csv,326,AvgCommunicate,Content,玩家,请这位主祭注意自己的身份，不要学这种街头宣传语。,"Chief Priest, please be mindful of your status. Please don't imitate charlatans..."
AvgCommunicate_57958_Content_4,abCv,avg通讯器聊天表_AvgCommunicate_A_M.csv,327,AvgCommunicate,Content,弥利亚姆,于丽埃特曾建议我，想要扩展信众，需要采用更加温和主动的宣传手段。,"Juliette suggested that in order to increase number of followers, we need to adopt a gentler and more proactive approach to our preaching."
AvgCommunicate_57958_Content_5,abCw,avg通讯器聊天表_AvgCommunicate_A_M.csv,328,AvgCommunicate,Content,弥利亚姆,我想，她的话不无道理。,I think there is merit in that suggestion.
AvgCommunicate_57958_Content_6,abCx,avg通讯器聊天表_AvgCommunicate_A_M.csv,329,AvgCommunicate,Content,弥利亚姆,只要能够宣扬吾主的恩泽，我可以尝试学习时下流行的语言方式。,"As long as it can spread the grace of our Lord, I'm willing to imitate any modern methods."
AvgCommunicate_57958_Content_10,abCp,avg通讯器聊天表_AvgCommunicate_A_M.csv,333,AvgCommunicate,Content,弥利亚姆,无妨，为了宣扬吾主的恩泽，我不会放弃任何一个冥顽之人。,"It doesn't matter. If it's to spread my Lord's grace, I won't give up even on the most stubborn of people."
AvgCommunicate_57958_Content_12,abCr,avg通讯器聊天表_AvgCommunicate_A_M.csv,335,AvgCommunicate,Content,弥利亚姆,作为与吾主有着深切链接之人，望守密人%sirormadam%准时参加。,"As someone who is deeply linked with my Lord, I hope Keeper %sirormadam% attends on time."
AvgCommunicate_57956_Option_2,abBU,avg通讯器聊天表_AvgCommunicate_A_M.csv,338,AvgCommunicate,Option,玩家,怎么了吗？,What's wrong?
AvgCommunicate_57956_Content_2,abBL,avg通讯器聊天表_AvgCommunicate_A_M.csv,338,AvgCommunicate,Content,玩家,怎么了吗？,What's wrong?
AvgCommunicate_57956_Option_3,abBV,avg通讯器聊天表_AvgCommunicate_A_M.csv,339,AvgCommunicate,Option,玩家,不介意的话，可以跟我说说？,Would you like to talk about it?
AvgCommunicate_57956_Content_3,abBM,avg通讯器聊天表_AvgCommunicate_A_M.csv,339,AvgCommunicate,Content,玩家,不介意的话，可以跟我说说？,Would you like to talk about it?
AvgCommunicate_57956_Content_6,abBP,avg通讯器聊天表_AvgCommunicate_A_M.csv,342,AvgCommunicate,Content,法洛思,她连洗手间都希望跟着我进去，这点实在是有点让人难为情。,She even wants to follow me into the restroom. It's a bit embarrassing.
AvgCommunicate_57957_Content_2,abCd,avg通讯器聊天表_AvgCommunicate_A_M.csv,347,AvgCommunicate,Content,玩家,我该猜到的，除了你，没有人会送我这个。,I should have guessed. You're the only person who would give me something like this.
AvgCommunicate_57957_Content_3,abCe,avg通讯器聊天表_AvgCommunicate_A_M.csv,348,AvgCommunicate,Content,珊,像所有艺术一样，雕塑也是一个很私人的东西。,"Like all art, sculpting is also a very personal thing."
AvgCommunicate_57957_Content_4,abCf,avg通讯器聊天表_AvgCommunicate_A_M.csv,349,AvgCommunicate,Content,珊,不是所有人都能和我一样，将这些石制的造物视作自己的延伸，生命的延续。,Not everyone can see these stone creations as an extension of themselves; a continuation of their life like I do.
AvgCommunicate_57957_Content_6,abCh,avg通讯器聊天表_AvgCommunicate_A_M.csv,351,AvgCommunicate,Content,珊,我亲爱的“珊瑚女”？,"My dear ""Ms. Coral""?"
AvgCommunicate_57988_Option_2,abEi,avg通讯器聊天表_AvgCommunicate_A_M.csv,353,AvgCommunicate,Option,玩家,怎么了？,What's wrong?
AvgCommunicate_57988_Content_3,abDS,avg通讯器聊天表_AvgCommunicate_A_M.csv,354,AvgCommunicate,Content,凯刻斯,我发现了一个能够激发血脉力量的偏方。,I discovered a remedy that can awaken one's bloodline powers.
AvgCommunicate_57988_Content_4,abDT,avg通讯器聊天表_AvgCommunicate_A_M.csv,355,AvgCommunicate,Content,凯刻斯,据说用了这个偏方，我就能拥有和戈利亚大人他们一样的力量了。,"Apparently, this remedy can grant me power similar to Lord Goliath's."
AvgCommunicate_57988_Option_5,abEl,avg通讯器聊天表_AvgCommunicate_A_M.csv,356,AvgCommunicate,Option,玩家,那是好事啊，就是怎么感觉有点可疑？,"Sounds good, but... it seems too good to be true..."
AvgCommunicate_57988_Content_5,abDU,avg通讯器聊天表_AvgCommunicate_A_M.csv,356,AvgCommunicate,Content,玩家,那是好事啊，就是怎么感觉有点可疑？,"Sounds good, but... it seems too good to be true..."
AvgCommunicate_57988_Content_6,abDV,avg通讯器聊天表_AvgCommunicate_A_M.csv,357,AvgCommunicate,Content,凯刻斯,我知道你可能会妒忌这份力量，没关系，我会自己尝试。,"You may envy me, but I'll accept those feelings. I'll go ahead and take it."
AvgCommunicate_57988_Content_7,abDW,avg通讯器聊天表_AvgCommunicate_A_M.csv,358,AvgCommunicate,Content,玩家,呃……虽然不知道你为什么这么想，那就祝你成功吧。,"Uh... Not sure why you'd think that, but good luck I guess."
AvgCommunicate_57988_Content_10,abDJ,avg通讯器聊天表_AvgCommunicate_A_M.csv,361,AvgCommunicate,Content,凯刻斯,作为投资，请给我五十，我去买下那个偏方。,I need fifty to buy the remedy. Consider it an investment.
AvgCommunicate_57988_Content_11,abDK,avg通讯器聊天表_AvgCommunicate_A_M.csv,362,AvgCommunicate,Content,凯刻斯,等我得到力量归来，一定百倍报答。,"Once my power awakens, I'll repay you a hundredfold."
AvgCommunicate_57988_Option_13,abEd,avg通讯器聊天表_AvgCommunicate_A_M.csv,364,AvgCommunicate,Option,玩家,槽点太多不知道从哪吐起了啊！,"There are so many things I want to say to you, I don't even know where to start!"
AvgCommunicate_57988_Content_13,abDM,avg通讯器聊天表_AvgCommunicate_A_M.csv,364,AvgCommunicate,Content,玩家,槽点太多不知道从哪吐起了啊！,"There are so many things I want to say to you, I don't even know where to start!"
AvgCommunicate_57988_Content_14,abDN,avg通讯器聊天表_AvgCommunicate_A_M.csv,365,AvgCommunicate,Content,玩家,虽然你还在坚持血脉这件事很不容易，但我觉得你或许该考虑一下被骗的可能性。,"Listen, I get that you still have a complex about your weak powers, but this just sounds like a scam..."
AvgCommunicate_57988_Content_15,abDO,avg通讯器聊天表_AvgCommunicate_A_M.csv,366,AvgCommunicate,Content,凯刻斯,是么，果然连你也不相信我吗。,Is that so? Sounds like you don't trust my judgment...
AvgCommunicate_57988_Option_16,abEg,avg通讯器聊天表_AvgCommunicate_A_M.csv,367,AvgCommunicate,Option,玩家,我不是我没有……,"Wait, it's not like that..!"
AvgCommunicate_57988_Content_16,abDP,avg通讯器聊天表_AvgCommunicate_A_M.csv,367,AvgCommunicate,Content,玩家,我不是我没有……,"Wait, it's not like that..!"
AvgCommunicate_57988_Content_17,abDQ,avg通讯器聊天表_AvgCommunicate_A_M.csv,368,AvgCommunicate,Content,凯刻斯,好吧，我会自己想办法，等我归来，一定会让你们都刮目相看。,"Whatever, I'll figure this out myself. When I'm reborn, you'll regret doubting me."
AvgCommunicate_57987_Content_1,abDk,avg通讯器聊天表_AvgCommunicate_A_M.csv,369,AvgCommunicate,Content,希莱斯特,居然能从这个盒子里直接收到人们的愿望。,So people can just send me their wishes through this little box?
AvgCommunicate_57987_Content_2,abDo,avg通讯器聊天表_AvgCommunicate_A_M.csv,370,AvgCommunicate,Content,希莱斯特,这是新的祈祷用品吗？,Is this a new tool for worship?
AvgCommunicate_57987_Option_3,abDB,avg通讯器聊天表_AvgCommunicate_A_M.csv,371,AvgCommunicate,Option,玩家,只是大家用来沟通的工具啦。,It's just a tool people can use to communicate.
AvgCommunicate_57987_Content_3,abDp,avg通讯器聊天表_AvgCommunicate_A_M.csv,371,AvgCommunicate,Content,玩家,只是大家用来沟通的工具啦。,It's just a tool people can use to communicate.
AvgCommunicate_57987_Content_4,abDq,avg通讯器聊天表_AvgCommunicate_A_M.csv,372,AvgCommunicate,Content,希莱斯特,沟通么？,Communicate?
AvgCommunicate_57987_Content_5,abDr,avg通讯器聊天表_AvgCommunicate_A_M.csv,373,AvgCommunicate,Content,希莱斯特,那么，你有什么愿望，请与我沟通吧。,"Well then, communicate with me. What is thy wish?"
AvgCommunicate_57987_Option_6,abDE,avg通讯器聊天表_AvgCommunicate_A_M.csv,374,AvgCommunicate,Option,玩家,不是这个意思啦！,"What? No, that's not what I meant!"
AvgCommunicate_57987_Content_6,abDs,avg通讯器聊天表_AvgCommunicate_A_M.csv,374,AvgCommunicate,Content,玩家,不是这个意思啦！,"What? No, that's not what I meant!"
AvgCommunicate_57987_Option_7,abDF,avg通讯器聊天表_AvgCommunicate_A_M.csv,375,AvgCommunicate,Option,玩家,不不，我没什么要麻烦你的。,"No, no, I don't have any wishes!"
AvgCommunicate_57987_Content_7,abDt,avg通讯器聊天表_AvgCommunicate_A_M.csv,375,AvgCommunicate,Content,玩家,不不，我没什么要麻烦你的。,"No, no, I don't have any wishes!"
AvgCommunicate_57987_Content_8,abDu,avg通讯器聊天表_AvgCommunicate_A_M.csv,376,AvgCommunicate,Content,希莱斯特,还没有愿望么？,You don't have wishes?
AvgCommunicate_57987_Content_9,abDv,avg通讯器聊天表_AvgCommunicate_A_M.csv,377,AvgCommunicate,Content,希莱斯特,没关系，想要许愿的时候就与我沟通吧。,"Very well. If you ever have a wish, let me know."
AvgCommunicate_57987_Content_10,abDl,avg通讯器聊天表_AvgCommunicate_A_M.csv,378,AvgCommunicate,Content,希莱斯特,人们的愿望总会有很多的。,People have always searched for a way to fulfill their desires.
AvgCommunicate_57987_Content_11,abDm,avg通讯器聊天表_AvgCommunicate_A_M.csv,379,AvgCommunicate,Content,希莱斯特,我会为你竭尽全力。,I will do my utmost to fullfill yours.
AvgCommunicate_57997_Content_1,abHQ,avg通讯器聊天表_AvgCommunicate_A_M.csv,381,AvgCommunicate,Content,达芙黛尔,交换商店酬宾活动，神秘福袋礼品抽取，三头一次，十头三次，预存十头送一头，欢迎光临选购。,"EXCLUSIVE OFFER! Mystery Gift Draw! Buy three of anything, get ONE FREE DRAW! Buy ten items, get THREE FREE DRAWS! Preorder ten items now and get an EXTRA ITEM FREE! Welcome!"
AvgCommunicate_57997_Option_3,abIh,avg通讯器聊天表_AvgCommunicate_A_M.csv,383,AvgCommunicate,Option,玩家,好像有什么很地狱的广告出现了。,Didn't know I could get scam messages...
AvgCommunicate_57997_Content_3,abHV,avg通讯器聊天表_AvgCommunicate_A_M.csv,383,AvgCommunicate,Content,玩家,好像有什么很地狱的广告出现了。以及这个数字是不是有哪里不对啊！,Didn't know I could get scam messages... Who even is this..?
AvgCommunicate_57997_Option_4,abIi,avg通讯器聊天表_AvgCommunicate_A_M.csv,384,AvgCommunicate,Option,玩家,以及这个数字是不是有哪里不对啊！,Who even is this..?
AvgCommunicate_57997_Content_4,abHW,avg通讯器聊天表_AvgCommunicate_A_M.csv,384,AvgCommunicate,Content,玩家,好像有什么很地狱的广告出现了。以及这个数字是不是有哪里不对啊！,Didn't know I could get scam messages... Who even is this..?
AvgCommunicate_57997_Content_5,abHX,avg通讯器聊天表_AvgCommunicate_A_M.csv,385,AvgCommunicate,Content,达芙黛尔,是守密人啊，如果是你的话，我可以给你额外打折哦。,"Why, if it isn't the Keeper! Just for you, I'll offer an additional discount."
AvgCommunicate_57997_Option_6,abIk,avg通讯器聊天表_AvgCommunicate_A_M.csv,386,AvgCommunicate,Option,玩家,虽然不是很想买……,I'm really not interested...
AvgCommunicate_57997_Content_6,abHY,avg通讯器聊天表_AvgCommunicate_A_M.csv,386,AvgCommunicate,Content,玩家,虽然不是很想买，但是打多少折？,"I'm really not interested in buying... But out of curiosity, what is it?"
AvgCommunicate_57997_Content_8,abIa,avg通讯器聊天表_AvgCommunicate_A_M.csv,388,AvgCommunicate,Content,达芙黛尔,嗯……勉为其难，九九折吧。,"Hmm... for you, I'll give you a good deal. I'll mark it down to 99%."
AvgCommunicate_57997_Option_10,abId,avg通讯器聊天表_AvgCommunicate_A_M.csv,390,AvgCommunicate,Option,玩家,这有什么区别！,That's it?!
AvgCommunicate_57997_Content_10,abHR,avg通讯器聊天表_AvgCommunicate_A_M.csv,390,AvgCommunicate,Content,玩家,这有什么区别！,That's it?!
AvgCommunicate_57997_Content_11,abHS,avg通讯器聊天表_AvgCommunicate_A_M.csv,391,AvgCommunicate,Content,达芙黛尔,价格已经很优惠了呀，毕竟小店的商品童叟无欺，口碑一直很好呢。,"Well, the price is already favorable as is. After all, my store is very fair and honest, with a stellar reputation."
AvgCommunicate_57997_Content_12,abHT,avg通讯器聊天表_AvgCommunicate_A_M.csv,392,AvgCommunicate,Content,达芙黛尔,你总会来找我的，不是吗？,"You always shop here, don't you?"
AvgCommunicate_57989_Content_1,abEq,avg通讯器聊天表_AvgCommunicate_A_M.csv,393,AvgCommunicate,Content,卡茜亚,你是否时常感到无聊乏味？,Are you feeling bored? Tired?! Like the world is just passing you by?!
AvgCommunicate_57989_Content_2,abEw,avg通讯器聊天表_AvgCommunicate_A_M.csv,394,AvgCommunicate,Content,卡茜亚,是否时常渴望一把火，将你的心与灵魂一并点燃？,Do you find yourself yearning for something NEW and EXCITING to ignite your desires?!
AvgCommunicate_57989_Option_3,abEL,avg通讯器聊天表_AvgCommunicate_A_M.csv,395,AvgCommunicate,Option,玩家,卡茜亚，你又在搞什么？,"...what are you on about, Casiah?"
AvgCommunicate_57989_Content_3,abEx,avg通讯器聊天表_AvgCommunicate_A_M.csv,395,AvgCommunicate,Content,玩家,卡茜亚，你又在搞什么？,"...what are you on about, Casiah?"
AvgCommunicate_57989_Content_4,abEy,avg通讯器聊天表_AvgCommunicate_A_M.csv,396,AvgCommunicate,Content,卡茜亚,放心，放心，魔法大师卡茜娅即将为你的生命带来转机，注入激情！,Well fret no more! The great master of magic Casiah is here to offer you a once in a lifetime opportunity that you won't want to miss!
AvgCommunicate_57989_Content_5,abEz,avg通讯器聊天表_AvgCommunicate_A_M.csv,397,AvgCommunicate,Content,卡茜亚,很荣幸能在这里向各位宣布，最新一届的卡茜亚的魔术嘉年华即将盛大开演！,It's my great pleasure to announce to you that the great Casiah's Magical Carnival is about to begin!
AvgCommunicate_57989_Option_7,abEP,avg通讯器聊天表_AvgCommunicate_A_M.csv,399,AvgCommunicate,Option,玩家,你是不是发错人了？,Did you mean to send this to me?
AvgCommunicate_57989_Content_7,abEB,avg通讯器聊天表_AvgCommunicate_A_M.csv,399,AvgCommunicate,Content,玩家,你是不是发错人了？,Did you mean to send this to me?
AvgCommunicate_57989_Content_8,abEC,avg通讯器聊天表_AvgCommunicate_A_M.csv,400,AvgCommunicate,Content,卡茜亚,从有变无、从无变有、点石成金，人体嫁接——只有想不到，没有看不到。卡茜亚大师保证能清空你的大脑，让你忘不了！,"Whether it be turning nothing into something, something into nothing, changing stone to gold, or even transforming the human form—whatever your wildest imagination could possibly dream of, the magic of the great Master Casiah is guaranteed to excite and amaze!"
AvgCommunicate_57989_Content_9,abED,avg通讯器聊天表_AvgCommunicate_A_M.csv,401,AvgCommunicate,Content,卡茜亚,现在回复信息，即可享入场券八折优惠哦！名额有限，先到先得，魔术嘉年华期待你的光临！,"Order a ticket now to enjoy a 20% discount! Limited slots available; first come, first served. We look forward to welcoming you to... the GREAT MAGICAL CARNIVAL!"
AvgCommunicate_57989_Content_13,abEu,avg通讯器聊天表_AvgCommunicate_A_M.csv,405,AvgCommunicate,Content,卡茜亚,我已经为你预备了特等席。,I've got a special seat reserved just for you.
AvgCommunicate_57989_Content_14,abEv,avg通讯器聊天表_AvgCommunicate_A_M.csv,406,AvgCommunicate,Content,卡茜亚,可不要失约哦。,I expect you to keep your promise.
AvgCommunicate_57993_Content_1,abGy,avg通讯器聊天表_AvgCommunicate_A_M.csv,407,AvgCommunicate,Content,艾瑞卡,■■守■■，■■■密人■■■,"■■Guard■■, ■■■Keeper■■■"
AvgCommunicate_57993_Content_3,abGH,avg通讯器聊天表_AvgCommunicate_A_M.csv,409,AvgCommunicate,Content,艾瑞卡,■瑞卡■■■■■重大错误，■守密■银芯■■■■■利普大楼■■■■■进行■■■■请■■■■■芯■■前■■■■■■3F维护,"■Erika■■■■Fatal Error, ■ Keeper■Silver Core■■■■Lip Building■■■■Action Required■■■Please Insert■■■Core■■Before■■■3F Maintenance"
AvgCommunicate_57993_Option_4,abGY,avg通讯器聊天表_AvgCommunicate_A_M.csv,410,AvgCommunicate,Option,玩家,你这是发的什么，通讯器无法显示加密通讯的。,I can't tell what you're saying... The communicator can't display encrypted messages.
AvgCommunicate_57993_Content_4,abGI,avg通讯器聊天表_AvgCommunicate_A_M.csv,410,AvgCommunicate,Content,玩家,你这是发的什么，通讯器无法显示加密通讯的。,I can't tell what you're saying... The communicator can't display encrypted messages.
