Key,ShortKey,Source,Row,Module,Field,Character,CN,EN
AvgCommunicate_67029_Content_10,acpf,avg通讯器聊天表_AvgCommunicate_A_M.csv,999,AvgCommunicate,Content,卡茜亚,所以卡茜亚想到了好办法，先从动物身上开始研究！这样就容易多啦！,So Casiah had a great idea: let's research animals! That's much easier!
AvgCommunicate_67029_Option_11,acpx,avg通讯器聊天表_AvgCommunicate_A_M.csv,1000,AvgCommunicate,Option,玩家,……所以那几只鸡现在在哪里？,...So where are the chickens now?
AvgCommunicate_67029_Content_11,acpg,avg通讯器聊天表_AvgCommunicate_A_M.csv,1000,AvgCommunicate,Content,玩家,……所以那几只鸡现在在哪里？,...So where are the chickens now?
AvgCommunicate_67029_Content_12,acph,avg通讯器聊天表_AvgCommunicate_A_M.csv,1001,AvgCommunicate,Content,卡茜亚,在卡茜亚的房间，现在已经有很多小鸡孵出来了！每天都非常热闹呢！,"In Casiah's room, where many newly hatched chicks now roam free! My room has become very lively!"
AvgCommunicate_67029_Option_13,acpz,avg通讯器聊天表_AvgCommunicate_A_M.csv,1002,AvgCommunicate,Option,玩家,给我好好还给食堂啊！！,Return those hens to the cafeteria already!!
AvgCommunicate_67029_Content_13,acpi,avg通讯器聊天表_AvgCommunicate_A_M.csv,1002,AvgCommunicate,Content,玩家,给我好好还给食堂啊！！,Return those hens to the cafeteria already!!
AvgCommunicate_67029_Content_14,acpj,avg通讯器聊天表_AvgCommunicate_A_M.csv,1003,AvgCommunicate,Content,卡茜亚,咦，你居然要残忍地拆散这些母子，真是太冷酷了！你这个没有母爱的人！,How cruel you are Keeper! Wishing to seperate these chicks from their mothers! Have you forgotten about maternal love?!
AvgCommunicate_67029_Option_15,acpB,avg通讯器聊天表_AvgCommunicate_A_M.csv,1004,AvgCommunicate,Option,玩家,我到底为什么要对鸡有母爱啊！,I'm not going to feel maternal love towards a bunch of chickens!
AvgCommunicate_67029_Content_15,acpk,avg通讯器聊天表_AvgCommunicate_A_M.csv,1004,AvgCommunicate,Content,玩家,我到底为什么要对鸡有母爱啊！,I'm not going to feel maternal love towards a bunch of chickens!
AvgCommunicate_67029_Option_16,acpC,avg通讯器聊天表_AvgCommunicate_A_M.csv,1005,AvgCommunicate,Option,玩家,以及真是唯独不想被你说冷酷啊！,And I won't be called cold-hearted by someone like you!
AvgCommunicate_67029_Content_16,acpl,avg通讯器聊天表_AvgCommunicate_A_M.csv,1005,AvgCommunicate,Content,玩家,以及真是唯独不想被你说冷酷啊！,And I won't be called cold-hearted by someone like you!
AvgCommunicate_66999_Content_2,abZQ,avg通讯器聊天表_AvgCommunicate_A_M.csv,1116,AvgCommunicate,Content,哈姆林,录音时朵尔教授还提到，校方制作出了一款新型的录音机，体型小巧，音质细腻，甚至可以在出任务时随身携带，有录音和播放的功能。,"During the recording session, Professor Doll also mentioned that the school had developed a new type of tape recorder. It's small and portable for missions, has clear audio, and features both recording and playback functions."
AvgCommunicate_66999_Content_3,abZR,avg通讯器聊天表_AvgCommunicate_A_M.csv,1117,AvgCommunicate,Content,哈姆林,我看到后就想到了你，如果需要的话，我可以为你录制你想听的乐曲。,"When I saw it, I thought of you. If you'd like, I can make a recording of the music you like to listen to."
AvgCommunicate_66999_Content_4,abZS,avg通讯器聊天表_AvgCommunicate_A_M.csv,1118,AvgCommunicate,Content,哈姆林,这样即使有时我不在你的身边，也不会担心没有音乐来抚慰你的灵魂。,"That way, even when I'm not by your side, you need not worry about lacking music to soothe your soul."
AvgCommunicate_66999_Option_5,acah,avg通讯器聊天表_AvgCommunicate_A_M.csv,1119,AvgCommunicate,Option,玩家,哈姆林……我好感动！,Hameln... I'm so moved!
AvgCommunicate_66999_Content_5,abZT,avg通讯器聊天表_AvgCommunicate_A_M.csv,1119,AvgCommunicate,Content,玩家,哈姆林……我好感动！,Hameln... I'm so moved!
AvgCommunicate_66999_Content_6,abZU,avg通讯器聊天表_AvgCommunicate_A_M.csv,1120,AvgCommunicate,Content,哈姆林,这都是我应尽的职责，那么，有什么想听的吗？,"It's simply fulfilling my duty. Well then, is there anything you wish to listen to?"
AvgCommunicate_66999_Option_7,acaj,avg通讯器聊天表_AvgCommunicate_A_M.csv,1121,AvgCommunicate,Option,玩家,有助睡眠的音乐,Relaxing music.
AvgCommunicate_66999_Content_7,abZV,avg通讯器聊天表_AvgCommunicate_A_M.csv,1121,AvgCommunicate,Content,玩家,说起来，每次听你吹奏摇篮曲的时候，我都会睡得很好。,"Speaking of which, I always sleep well whenever you perform a lullaby."
AvgCommunicate_66999_Content_8,abZW,avg通讯器聊天表_AvgCommunicate_A_M.csv,1122,AvgCommunicate,Content,玩家,这首曲子有什么特别的吗？,What's makes it so special?
AvgCommunicate_66999_Content_9,abZX,avg通讯器聊天表_AvgCommunicate_A_M.csv,1123,AvgCommunicate,Content,哈姆林,要这一首吗？我明白了。,You wish to hear that style? Understood.
AvgCommunicate_66999_Content_10,abZL,avg通讯器聊天表_AvgCommunicate_A_M.csv,1124,AvgCommunicate,Content,哈姆林,如果非要说特别之处，大概是充满了我守护你的心情吧。,"If I must specify what’s special about it, it must be because it’s brimming with my need to protect you. "
AvgCommunicate_66999_Option_11,acaa,avg通讯器聊天表_AvgCommunicate_A_M.csv,1125,AvgCommunicate,Option,玩家,帮助起床的音乐,Energetic music.
AvgCommunicate_66999_Content_11,abZM,avg通讯器聊天表_AvgCommunicate_A_M.csv,1125,AvgCommunicate,Content,玩家,其实我一直都有点起床困难，如果有那种令人振奋的音乐，起床应该会容易一些吧！,"Actually, I’ve always had a bit of trouble getting up. If I had some rousing music, it would probable be easier to get out of bed!"
AvgCommunicate_66999_Content_12,abZN,avg通讯器聊天表_AvgCommunicate_A_M.csv,1126,AvgCommunicate,Content,哈姆林,令人振奋吗？我明白了。,Rousing music? Understood.
AvgCommunicate_66999_Content_13,abZO,avg通讯器聊天表_AvgCommunicate_A_M.csv,1127,AvgCommunicate,Content,哈姆林,虽然我觉得充足良好的睡眠才是更重要的，但毕竟你肩负了如此多的责任，忙碌也是在所难免。,"Even though I think it’s more important to get quality sleep, you shoulder such numerous burdens that business is unavoidable."
AvgCommunicate_66999_Content_14,abZP,avg通讯器聊天表_AvgCommunicate_A_M.csv,1128,AvgCommunicate,Content,哈姆林,希望这首进行曲能够带给你力量。,May this march lend you strength!
AvgCommunicate_66977_Content_1,abNq,avg通讯器聊天表_AvgCommunicate_A_M.csv,1255,AvgCommunicate,Content,二十四,守密人！请问我刚刚是不是去给你送了饼干？,Keeper! Did I just bring you some cookies?
AvgCommunicate_66977_Option_2,abNM,avg通讯器聊天表_AvgCommunicate_A_M.csv,1256,AvgCommunicate,Option,玩家,呃，没错？,"Uh, yeah?"
AvgCommunicate_66977_Content_2,abNx,avg通讯器聊天表_AvgCommunicate_A_M.csv,1256,AvgCommunicate,Content,玩家,呃，没错？我刚刚吃完，味道很不错，你的手艺真是越来越好了。,"Uh, yeah? I just finished eating them, they were delicious. You've gotten really good at baking."
AvgCommunicate_66977_Content_3,abNy,avg通讯器聊天表_AvgCommunicate_A_M.csv,1257,AvgCommunicate,Content,二十四,啊！天呐！我来就是想告诉你千万不要吃那些饼干！那些饼干不是我做的！,Oh no! I wanted to tell you to NOT eat those cookies! I didn't make them!
AvgCommunicate_66977_Option_4,abNO,avg通讯器聊天表_AvgCommunicate_A_M.csv,1258,AvgCommunicate,Option,玩家,什么？不是你做的？,"Wait, what? You didn't make them?"
AvgCommunicate_66977_Content_4,abNz,avg通讯器聊天表_AvgCommunicate_A_M.csv,1258,AvgCommunicate,Content,玩家,什么？不是你做的？,"Wait, what? You didn't make them?"
AvgCommunicate_66977_Content_5,abNA,avg通讯器聊天表_AvgCommunicate_A_M.csv,1259,AvgCommunicate,Content,二十四,是的，刚刚给你送饼干的是我另一个新诞生的人格，她非常喜欢恶作剧……,Yes! The one that made those cookies is one of my new personalities. She loves playing pranks...
AvgCommunicate_66977_Content_6,abNB,avg通讯器聊天表_AvgCommunicate_A_M.csv,1260,AvgCommunicate,Content,二十四,我模糊地记得她好像在做饼干的时候加入了什么东西……总之你现在有没有哪里不舒服？,I think she added something to the cookies while she made them... Are you alright?
AvgCommunicate_66977_Option_7,abNR,avg通讯器聊天表_AvgCommunicate_A_M.csv,1261,AvgCommunicate,Option,玩家,你这么一说，我突然感觉全身都不舒服了……,"Now that you mention it, I'm feeling a sudden sense of dread..."
AvgCommunicate_66977_Content_7,abNC,avg通讯器聊天表_AvgCommunicate_A_M.csv,1261,AvgCommunicate,Content,玩家,你这么一说，我突然感觉全身都不舒服了……,"Now that you mention it, I'm feeling a sudden sense of dread..."
AvgCommunicate_66977_Content_8,abND,avg通讯器聊天表_AvgCommunicate_A_M.csv,1262,AvgCommunicate,Content,玩家,她到底放了什么，总不会是致命毒药吧？？,"What did she add? It's not poison, is it?!"
AvgCommunicate_66977_Content_9,abNE,avg通讯器聊天表_AvgCommunicate_A_M.csv,1263,AvgCommunicate,Content,二十四,应该不会的！她只是喜欢恶作剧，并没有那么邪恶。,I don't think she'd go that far! She just likes to prank people.
AvgCommunicate_66977_Content_10,abNr,avg通讯器聊天表_AvgCommunicate_A_M.csv,1264,AvgCommunicate,Content,二十四,怎么办，我又给你添麻烦了，我，我现在去联系茜尔维亚女士！,What should I do? I've troubled you again. I'll contact Ms. Sylvia right away!
AvgCommunicate_66977_Option_11,abNH,avg通讯器聊天表_AvgCommunicate_A_M.csv,1265,AvgCommunicate,Option,玩家,等等，慢着，不用了……,"Wait, don't..."
AvgCommunicate_66977_Content_11,abNs,avg通讯器聊天表_AvgCommunicate_A_M.csv,1265,AvgCommunicate,Content,玩家,等等，慢着，不用了……我知道她放的是什么了……,"Wait, don't... I think I figured out what she added..."
AvgCommunicate_66977_Option_13,abNJ,avg通讯器聊天表_AvgCommunicate_A_M.csv,1267,AvgCommunicate,Option,玩家,是泻药……,The thing she added...
AvgCommunicate_66977_Content_13,abNu,avg通讯器聊天表_AvgCommunicate_A_M.csv,1267,AvgCommunicate,Content,玩家,是泻药……不说了……我要赶紧去一下厕所……,The thing she added... it was a laxative. I'll be going to the bathroom now.
AvgCommunicate_66977_Content_14,abNv,avg通讯器聊天表_AvgCommunicate_A_M.csv,1268,AvgCommunicate,Content,玩家,我房间的纸可能不够了，一会儿记得给我送点纸……,"I might run out of paper, so please bring me some later..."
AvgCommunicate_66977_Content_15,abNw,avg通讯器聊天表_AvgCommunicate_A_M.csv,1269,AvgCommunicate,Content,二十四,好，好的，我会的！对不起！！,"I will, I'll do it! I'm sorry!!"
AvgCommunicate_67025_Content_1,acni,avg通讯器聊天表_AvgCommunicate_A_M.csv,1329,AvgCommunicate,Content,艾尔瓦,这一阵实行的军犬陪同训练效果超乎我的想象。,It seems the addition of military dogs to my training have far exceeded my expectations.
AvgCommunicate_67025_Content_2,acnk,avg通讯器聊天表_AvgCommunicate_A_M.csv,1330,AvgCommunicate,Content,艾尔瓦,甚至有原本不参与体能训练的同学也来找我报名上课，大家的热情真是让我惊讶。,Even students who didn't originally participate in physical training are signing up for my classes. I'm really surprised by everyone's enthusiasm.
AvgCommunicate_67025_Option_3,acnv,avg通讯器聊天表_AvgCommunicate_A_M.csv,1331,AvgCommunicate,Option,玩家,毕竟毛绒绒的小狗没有人能够拒绝！！！,Nobody could possibly resist the charm of fluffy puppies!!!
AvgCommunicate_67025_Content_3,acnl,avg通讯器聊天表_AvgCommunicate_A_M.csv,1331,AvgCommunicate,Content,玩家,毕竟毛绒绒的小狗没有人能够拒绝！！！,Nobody could possibly resist the charm of fluffy puppies!!!
AvgCommunicate_67025_Content_4,acnm,avg通讯器聊天表_AvgCommunicate_A_M.csv,1332,AvgCommunicate,Content,艾尔瓦,的确，为了让小狗和同学们培养出更多配合的默契，我选用的都是尚未成年的幼犬。,Indeed. I selected puppies in order to foster better teamwork among the students.
AvgCommunicate_67025_Content_5,acnn,avg通讯器聊天表_AvgCommunicate_A_M.csv,1333,AvgCommunicate,Content,艾尔瓦,虽然我和大家一样喜欢这些小家伙们，但幼犬需要的照顾和教导的确要比成年犬多得多。,"While I do adore these little ones as much as my students do, they do require more care and training than adult dogs."
AvgCommunicate_67025_Content_6,acno,avg通讯器聊天表_AvgCommunicate_A_M.csv,1334,AvgCommunicate,Content,艾尔瓦,现在报名人数增加，相应的小狗数量也要增加，还真让我有些招架不来。,"With the increased number of students enrolling in my class, the number of puppies needed has also increased. It's become difficult for me to handle them all myself."
AvgCommunicate_67025_Option_7,acnz,avg通讯器聊天表_AvgCommunicate_A_M.csv,1335,AvgCommunicate,Option,玩家,这太简单了。,An easily solved problem!
AvgCommunicate_67025_Content_7,acnp,avg通讯器聊天表_AvgCommunicate_A_M.csv,1335,AvgCommunicate,Content,玩家,这太简单了，只要艾尔瓦教官一声令下，保证有更多的人愿意报名来照顾小狗，到时候只怕小狗都不够分。,"An easily solved problem! If Instructor Alva simply asks for some assistance, plenty of people will sign up to take care of the puppies. In fact, there might be more volunteers then puppies!"
AvgCommunicate_67025_Content_8,acnq,avg通讯器聊天表_AvgCommunicate_A_M.csv,1336,AvgCommunicate,Content,艾尔瓦,你是说招募一些志愿者吗？确实是好主意。,Recruiting volunteers? That's a good idea.
AvgCommunicate_67025_Content_9,acnr,avg通讯器聊天表_AvgCommunicate_A_M.csv,1337,AvgCommunicate,Content,艾尔瓦,那么我一会就去找诃勒特院长申请这件事，顺利的话，同学们也可以见到更多的小狗了。,"I'll make a request to Dean Czort to sign off on this. If all goes well, the students will also be able to see more puppies."
AvgCommunicate_66993_Content_1,abWQ,avg通讯器聊天表_AvgCommunicate_A_M.csv,1400,AvgCommunicate,Content,艾继丝,守密人，请问……您什么时候有时间，能够与我见一次面呢？,"Keeper, if it's OK... would you have time to meet with me?"
AvgCommunicate_66993_Content_2,abWW,avg通讯器聊天表_AvgCommunicate_A_M.csv,1401,AvgCommunicate,Content,艾继丝,啊，当然！如果您很忙的话，能够把贴身的衣物借给我也是可以的！,"Oh, but..! If you're too busy, lending me your underwear would work too!"
AvgCommunicate_66993_Option_3,abXl,avg通讯器聊天表_AvgCommunicate_A_M.csv,1402,AvgCommunicate,Option,玩家,贴身衣物？这是要做什么吗？,Underwear? Why do you need that?
AvgCommunicate_66993_Content_3,abWX,avg通讯器聊天表_AvgCommunicate_A_M.csv,1402,AvgCommunicate,Content,玩家,贴身衣物？这是要做什么吗？,Underwear? Why do you need that?
AvgCommunicate_66993_Content_4,abWY,avg通讯器聊天表_AvgCommunicate_A_M.csv,1403,AvgCommunicate,Content,艾继丝,是，是这样的，最近我和梅森姐姐学会了织毛线，我给莉莉和詹金织了围巾和帽子。,"Yes, well... Recently, I've been learning to knit with Sister Mason. So far I've made scarves and hats for Lily and Jenkin."
AvgCommunicate_66993_Option_5,abXn,avg通讯器聊天表_AvgCommunicate_A_M.csv,1404,AvgCommunicate,Option,玩家,哇，真厉害呀！,"Wow, that's impressive!"
AvgCommunicate_66993_Content_5,abWZ,avg通讯器聊天表_AvgCommunicate_A_M.csv,1404,AvgCommunicate,Content,玩家,哇，真厉害呀！,"Wow, that's impressive!"
AvgCommunicate_66993_Content_6,abXa,avg通讯器聊天表_AvgCommunicate_A_M.csv,1405,AvgCommunicate,Content,艾继丝,没有，都是很简单的……,"No, it's nothing special..."
AvgCommunicate_66993_Content_7,abXb,avg通讯器聊天表_AvgCommunicate_A_M.csv,1406,AvgCommunicate,Content,艾继丝,不过现在我已经很熟练了，可以织一些更难的东西，所以想给守密人织一件毛衣！,"But now I'm skilled enough to knit more complex things, so I want to knit a sweater for you, Keeper!"
AvgCommunicate_66993_Content_8,abXc,avg通讯器聊天表_AvgCommunicate_A_M.csv,1407,AvgCommunicate,Content,艾继丝,毛衣的话，我需要给守密人量一下尺寸，当然，如果守密人不需要的话就不用麻烦了！,"Before I knit the sweater, I need your measurements. Oh, but if you don't want it, then you don't have to!"
AvgCommunicate_66993_Option_9,abXr,avg通讯器聊天表_AvgCommunicate_A_M.csv,1408,AvgCommunicate,Option,玩家,怎么会呢？小艾继丝想着我，我高兴还来不及。,How could that be the case? I'm happy that Aigis is thinking about me.
AvgCommunicate_66993_Content_9,abXd,avg通讯器聊天表_AvgCommunicate_A_M.csv,1408,AvgCommunicate,Content,玩家,怎么会呢？小艾继丝想着我，我高兴还来不及。,How could that be the case? I'm happy that Aigis is thinking about me.
AvgCommunicate_66993_Content_11,abWS,avg通讯器聊天表_AvgCommunicate_A_M.csv,1410,AvgCommunicate,Content,艾继丝,我觉得红色或者白色的毛衣都很好看，守密人想要什么颜色的呢？,"I think both red or white sweaters would look good on you. Which color do you want, Keeper?"
AvgCommunicate_66993_Content_14,abWV,avg通讯器聊天表_AvgCommunicate_A_M.csv,1413,AvgCommunicate,Content,艾继丝,好的，艾继丝记住了！我会努力的！,"OK, Aigis will remember! I'll do my best!"
AvgCommunicate_66978_Content_1,abNU,avg通讯器聊天表_AvgCommunicate_A_M.csv,1490,AvgCommunicate,Content,阿格里帕,喂！快来帮我！我被被子缠住了！,Hey! Help me! I'm tangled up in the blanket!
AvgCommunicate_66978_Option_2,abOs,avg通讯器聊天表_AvgCommunicate_A_M.csv,1491,AvgCommunicate,Option,玩家,？你被什么？？,"? I'm sorry, what??"
AvgCommunicate_66978_Content_2,abOc,avg通讯器聊天表_AvgCommunicate_A_M.csv,1491,AvgCommunicate,Content,玩家,？你被什么？？,"? I'm sorry, what??"
AvgCommunicate_66978_Content_3,abOd,avg通讯器聊天表_AvgCommunicate_A_M.csv,1492,AvgCommunicate,Content,阿格里帕,还不是都怪你们不给我配奴隶！！谁知道这个破被单为什么这么难换啊！,This is all your fault for not assigning me slaves!! Why the hell is this damn bedsheet so difficult to change?!
AvgCommunicate_66978_Content_4,abOe,avg通讯器聊天表_AvgCommunicate_A_M.csv,1493,AvgCommunicate,Content,阿格里帕,怎么塞都塞不明白，气得我跟被子打了起来！,"I coudn't figure out how to fold it, so I started fighting with the blanket!"
AvgCommunicate_66978_Content_6,abOg,avg通讯器聊天表_AvgCommunicate_A_M.csv,1495,AvgCommunicate,Content,阿格里帕,愣着干什么，还不快过来救我！我出不来了！,"Well?! Don't just ... me, hurry up and save me! I can't get out!"
AvgCommunicate_66978_Option_7,abOx,avg通讯器聊天表_AvgCommunicate_A_M.csv,1496,AvgCommunicate,Option,玩家,有时候很疑惑你这种人是怎么活到这么大的。,I'm honestly impressed that someone like you has managed to survive this long.
AvgCommunicate_66978_Content_7,abOh,avg通讯器聊天表_AvgCommunicate_A_M.csv,1496,AvgCommunicate,Content,玩家,有时候很疑惑你这种人是怎么活到这么大的。,I'm honestly impressed that someone like you has managed to survive this long.
AvgCommunicate_66978_Content_8,abOi,avg通讯器聊天表_AvgCommunicate_A_M.csv,1497,AvgCommunicate,Content,阿格里帕,明明这些都是奴隶该做的工作，怎么会这么困难……,These menial tasks are for slaves to do! Why are they so difficult...?
AvgCommunicate_66978_Content_9,abOj,avg通讯器聊天表_AvgCommunicate_A_M.csv,1498,AvgCommunicate,Content,阿格里帕,以前那些奴隶每天都在做这些吗？不可能，他们是怎么做到的？,Did those slaves really do this every day? That's impossible! How did they do it?
AvgCommunicate_66978_Option_10,abOl,avg通讯器聊天表_AvgCommunicate_A_M.csv,1499,AvgCommunicate,Option,玩家,这已经算最简单的家务了，你真是脱离生活太久了。,This is one of the easiest chores someone could do. You're completely out of touch with normal day to day life.
AvgCommunicate_66978_Content_10,abNV,avg通讯器聊天表_AvgCommunicate_A_M.csv,1499,AvgCommunicate,Content,玩家,这已经算最简单的家务了，你真是脱离生活太久了。,This is one of the easiest chores someone could do. You're completely out of touch with normal day to day life.
AvgCommunicate_66978_Content_11,abNW,avg通讯器聊天表_AvgCommunicate_A_M.csv,1500,AvgCommunicate,Content,阿格里帕,哼……那我以后对奴隶温柔一点就是了，你快给我找些勤劳的奴隶来！,Hmph... I suppose I'll treat my future slaves better. Now go find me some hard working ones!
AvgCommunicate_66978_Option_12,abOn,avg通讯器聊天表_AvgCommunicate_A_M.csv,1501,AvgCommunicate,Option,玩家,都说了罗马亡了啊！,How many times do I have to tell you that Rome is long gone!
AvgCommunicate_66978_Content_12,abNX,avg通讯器聊天表_AvgCommunicate_A_M.csv,1501,AvgCommunicate,Content,玩家,都说了罗马亡了啊！,How many times do I have to tell you that Rome is long gone!
AvgCommunicate_66978_Option_13,abOo,avg通讯器聊天表_AvgCommunicate_A_M.csv,1502,AvgCommunicate,Option,玩家,现在是法制社会，你做梦吧！,There aren't any slaves to serve you in modern day society!
AvgCommunicate_66978_Content_13,abNY,avg通讯器聊天表_AvgCommunicate_A_M.csv,1502,AvgCommunicate,Content,玩家,现在是法制社会，你做梦吧！,There aren't any slaves to serve you in modern day society!
AvgCommunicate_66978_Content_14,abNZ,avg通讯器聊天表_AvgCommunicate_A_M.csv,1503,AvgCommunicate,Content,阿格里帕,我不管！我不管啊啊啊啊，要我每天做这些家务不如让我去死！！,"I don't care, I don't care, I don't care! I'd rather die than be forced to do these chores every day!"
AvgCommunicate_66978_Option_15,abOq,avg通讯器聊天表_AvgCommunicate_A_M.csv,1504,AvgCommunicate,Option,玩家,呵呵，不止家务，还有作业呢。,"Both chores and homework, huh?"
AvgCommunicate_66978_Content_15,abOa,avg通讯器聊天表_AvgCommunicate_A_M.csv,1504,AvgCommunicate,Content,玩家,呵呵，不止家务，还有作业呢。,"Both chores and homework, huh?"
AvgCommunicate_66978_Content_16,abOb,avg通讯器聊天表_AvgCommunicate_A_M.csv,1505,AvgCommunicate,Content,阿格里帕,我要把你丢进迷宫喂子嗣！！！！,I'll throw you into the maze to feed my babies!!!
AvgCommunicate_67054_Option_2,acDe,avg通讯器聊天表_AvgCommunicate_A_M.csv,1507,AvgCommunicate,Option,玩家,怎么搞的？？,What happened??
AvgCommunicate_67054_Content_2,acCV,avg通讯器聊天表_AvgCommunicate_A_M.csv,1507,AvgCommunicate,Content,玩家,怎么搞的？？,What happened??
AvgCommunicate_67054_Content_3,acCW,avg通讯器聊天表_AvgCommunicate_A_M.csv,1508,AvgCommunicate,Content,奥瑞塔,刚刚奥瑞塔想和伙伴们一起玩，于是跳进了鱼缸里，结果，哗啦——,So Aurita wanted to play with her friends! So I jumped into the fish tank—splash—
AvgCommunicate_67054_Content_4,acCX,avg通讯器聊天表_AvgCommunicate_A_M.csv,1509,AvgCommunicate,Content,奥瑞塔,奥瑞塔太大，鱼缸太小，里面的水就全都挤出来啦！,But Aurita is too big! And the tank is too small! So all the water in the tank splashed out!
AvgCommunicate_67054_Option_5,acDh,avg通讯器聊天表_AvgCommunicate_A_M.csv,1510,AvgCommunicate,Option,玩家,呃，是你能做出来的事，没事，我这就来。,"Well, that's about what I suspected. Don't worry, I'm on my way."
AvgCommunicate_67054_Content_5,acCY,avg通讯器聊天表_AvgCommunicate_A_M.csv,1510,AvgCommunicate,Content,玩家,呃，是你能做出来的事，没事，我这就来。,"Well, that's about what I suspected. Don't worry, I'm on my way."
AvgCommunicate_67054_Content_6,acCZ,avg通讯器聊天表_AvgCommunicate_A_M.csv,1511,AvgCommunicate,Content,奥瑞塔,唉，奥瑞塔想要一个大大的鱼缸，超级大，有整个房间那么大！,"Mm... Aurita wishes she had a big fish tank! A SUPER big one, as big as my room!"
AvgCommunicate_67054_Content_7,acDa,avg通讯器聊天表_AvgCommunicate_A_M.csv,1512,AvgCommunicate,Content,奥瑞塔,这样奥瑞塔和伙伴们就可以每天都在一起玩了！,"That way, Aurita and her friends can play together every day!"
AvgCommunicate_67054_Option_8,acDk,avg通讯器聊天表_AvgCommunicate_A_M.csv,1513,AvgCommunicate,Option,玩家,梦想很美好，然而学校并没有经费建一个水族馆啊！,"It's a nice wish, but the school can't afford to build an aquarium!"
AvgCommunicate_67054_Content_8,acDb,avg通讯器聊天表_AvgCommunicate_A_M.csv,1513,AvgCommunicate,Content,玩家,梦想很美好，然而学校并没有经费建一个水族馆啊！,"It's a nice wish, but the school can't afford to build an aquarium!"
AvgCommunicate_67054_Content_9,acDc,avg通讯器聊天表_AvgCommunicate_A_M.csv,1514,AvgCommunicate,Content,奥瑞塔,哎——为什么，那半个房间那么大的也可以嘛！,Mm—Even one as big as half a room would work too!
