,,,,,,,,,,,,,,,,,,
AvgCommunicate_57992_Content_1,abGc,avg通讯器聊天表_AvgCommunicate_A_M.csv,494,AvgCommunicate,Content,哈姆林,这里的音乐教室堪称简陋。,The music room here can only be called rudimentary.,Музыкальный класс здесь можно назвать скромным.,El aula de música aquí es bastante simple,ここにある音楽室は簡陋だ。,여기의 음악 교실은 상당히 초라하다.,La salle de musique ici est rudimentaire,Der Musikraum hier ist ziemlich einfach,Aqui a sala de música é muito simples,ห้องดนตรีที่นี่ค่อนข้างเรียบง่าย,Ruang musik di sini bisa dianggap sangat sederhana.,Phòng học nhạc ở đây có thể nói là thô sơ.
AvgCommunicate_57992_Content_2,abGf,avg通讯器聊天表_AvgCommunicate_A_M.csv,495,AvgCommunicate,Content,哈姆林,礼堂也实在是不堪入目。,The hall here is also truly unsightly.,Аудитория также выглядит неприглядно.,El salón es realmente un desastre,礼堂も本当に見苦しい状態だ。,대회장도 정말 보기 흉합니다.,La salle de réception est vraiment en piteux état,Die Halle ist wirklich in einem erbärmlichen Zustand,O salão está realmente deplorável,หอประชุมก็แย่จนแทบจะมองไม่ได้,Aula juga benar-benar tidak enak dipandang.,Hội trường cũng thực sự không thể chịu đựng được.
AvgCommunicate_57992_Content_3,abGg,avg通讯器聊天表_AvgCommunicate_A_M.csv,496,AvgCommunicate,Content,哈姆林,还有你们的那些乐器，负责维护的人是谁，难道不知道定期调音吗？,"“And those instruments of yours, who is responsible for maintaining them? Don't they know they require periodic tuning?”","А ещё, кто отвечает за ваши инструменты? Неужели не знают, что их нужно регулярно настраивать?","Y sus instrumentos, ¿quién los mantiene? ¿No saben que deben afinarse regularmente?",それにあなたの楽器たち、メンテナンスをしている人は誰ですか。定期的な調律を知らなかったの？,여러분의 악기를 관리하는 사람이 정기적으로 조율하지 않는 걸 모르나요?,"Et vos instruments, qui s'en occupe ? Ne savent-ils pas qu'il faut les accorder régulièrement ?","Und eure Instrumente, wer ist für die Wartung zuständig? Kennt ihr keine regelmäßige Stimmung?","E seus instrumentos, quem é responsável pela manutenção? Não sabem que precisam ser afinados regularmente?",แล้วเครื่องดนตรีของพวกคุณล่ะ ใครเป็นคนดูแล หรือยังไม่รู้ว่าควรปรับเสียงเป็นประจำใช่ไหม?,"Dan alat musik kalian, siapa yang bertanggung jawab untuk merawatnya? Apakah tidak tahu bahwa mereka perlu di-tuning secara berkala?","Còn những nhạc cụ của các người, người phụ trách bảo trì là ai, chẳng lẽ không biết chỉnh dây thường xuyên sao?"
AvgCommunicate_57992_Content_5,abGi,avg通讯器聊天表_AvgCommunicate_A_M.csv,498,AvgCommunicate,Content,哈姆林,难以置信，这就是高等学府的音乐素养吗？简直让人无法接受。,"“Unbelievable, is this the musical capacity of a prestigious university? It's simply unacceptable.”","Невероятно, это уровень музыкальной культуры в высшем учебном заведении? Это просто невозможно принять.","Increíble, ¿es esta la calidad musical de una institución superior? Es inaceptable",信じられない、これが高等教育機関の音楽教養なのか。まったく受け入れがたい。,"믿을 수 없어, 이게 고등 교육기관의 음악 소양이야? 정말 참을 수 없어.","Incroyable, c'est ça le niveau musical d'une grande école ? Inacceptable","Unglaublich, ist das das musikalische Niveau einer Hochschule? Einfach unakzeptabel","Inacreditável, essa é a qualidade musical de uma universidade? Inaceitável",เหลือเชื่อจริงๆ นี่คือระดับการศึกษาด้านดนตรีของสถาบันอุดมศึกษาหรือ? ยอมรับไม่ได้เลย,"Sulit dipercaya, inilah tingkat pemahaman musik dari institusi pendidikan tinggi? Benar-benar tidak dapat diterima.","Không thể tin được, đây là trình độ âm nhạc của một trường đại học sao? Thật sự không thể chấp nhận được."
AvgCommunicate_57992_Content_6,abGj,avg通讯器聊天表_AvgCommunicate_A_M.csv,499,AvgCommunicate,Content,哈姆林,从今天开始，这些东西就由我全面接管了。,"“From today onward, I shall take on the mantle of overseeing these matters.”","Начиная с сегодняшнего дня, я полностью беру на себя управление этими вещами.","Desde hoy, me encargaré de estas cosas",今日から、これらのものは私が全面的に管理します。,오늘부터 이 일들은 전부 내가 담당할 거예요.,": À partir d'aujourd'hui, je prends tout en charge",Ab heute übernehme ich diese Dinge vollständig,"A partir de hoje, eu assumo o controle total dessas coisas",ตั้งแต่วันนี้เป็นต้นไป สิ่งเหล่านี้จะอยู่ภายใต้การดูแลของฉันทั้งหมด.,"Mulai hari ini, semua hal ini akan sepenuhnya saya ambil alih.","Từ hôm nay, những thứ này sẽ do tôi tự mình đảm nhận."
AvgCommunicate_57992_Content_7,abGk,avg通讯器聊天表_AvgCommunicate_A_M.csv,500,AvgCommunicate,Content,哈姆林,在银霜节之前，我一定要训练出一个合格的乐团。,I must train a qualified orchestra before the Silverfrost Festival.,Перед Серебряным Имфестом я обязательно должен подготовить квалифицированный оркестр.,"Antes del Festival de la Escarcha Plateada, debo entrenar a una banda competente",銀霜祭りの前に、私は必ず合格な楽団を鍛えなければならない。,은상절 전에 반드시 적합한 오케스트라를 연습시켜야 합니다.,"Avant le Festival de la Givre d'Argent, je dois former un orchestre compétent",Vor dem Silberfrostfest muss ich ein qualifiziertes Orchester ausbilden,"Antes do Festival da Geada Prateada, eu devo treinar uma orquestra qualificada",ก่อนเทศกาล Silver Frost ฉันต้องฝึกวงออร์เคสตราให้ได้มาตรฐาน,"Sebelum Festival Perak dan Embun, aku harus melatih sebuah orkestra yang layak.","Trước Lễ Bạc Sương, tôi nhất định phải huấn luyện ra một dàn nhạc đủ tiêu chuẩn."
AvgCommunicate_57992_Option_8,abGw,avg通讯器聊天表_AvgCommunicate_A_M.csv,501,AvgCommunicate,Option,玩家,幸好我不是乐团成员。,Thank goodness I'm not a member of the orchestra.,"К счастью, я Не член оркестра.","Por suerte, no soy miembro de la orquesta",何より私はバンドのメンバーじゃないです。,행운이 나는 밴드 멤버가 아니다.,"Heureusement, je ne suis pas membre de l'orchestre",Zum Glück bin ich kein Mitglied des Orchesters,Ainda bem que não sou membro da orquestra,โชคดีนะที่ฉันไม่ได้อยู่ในวงดนตรี,"Untungnya, aku bukan anggota orkestra.","May mắn thay, tôi không phải là thành viên của ban nhạc."
AvgCommunicate_57992_Content_8,abGl,avg通讯器聊天表_AvgCommunicate_A_M.csv,501,AvgCommunicate,Content,玩家,幸好我不是乐团成员。,Thank goodness I'm not a member of the orchestra.,"К счастью, я Не член оркестра.","Por suerte, no soy miembro de la orquesta",何より私はバンドのメンバーじゃないです。,행운이 나는 밴드 멤버가 아니다.,"Heureusement, je ne suis pas membre de l'orchestre",Zum Glück bin ich kein Mitglied des Orchesters,Ainda bem que não sou membro da orquestra,โชคดีนะที่ฉันไม่ได้อยู่ในวงดนตรี,"Untungnya, aku bukan anggota orkestra.","May mắn thay, tôi không phải là thành viên của ban nhạc."
AvgCommunicate_57992_Content_9,abGm,avg通讯器聊天表_AvgCommunicate_A_M.csv,502,AvgCommunicate,Content,哈姆林,你也别想走，指挥家。,"“Don’t think you’re off the hook, Conductor.”","И тебе не удастся уйти, дирижёр.","Tú tampoco te irás, director",君も逃げられないぞ、指揮者。,"너도 가는 생각 하지 마, 지휘자.","Toi non plus, tu ne partiras pas, chef d'orchestre","Du wirst auch nicht entkommen, Dirigent","Você também não vai escapar, maestro",คุณอย่าคิดจะหนีไปได้ วาทยกร,"Kamu juga tidak bisa pergi, Komandan.","Bạn cũng đừng hòng bỏ đi, người chỉ huy."
AvgCommunicate_57992_Content_11,abGe,avg通讯器聊天表_AvgCommunicate_A_M.csv,504,AvgCommunicate,Content,玩家,我没有报名啊！,But I never signed up!,Я не регистрировался!,¡No me inscribí!,私は申し込んでいないよ！,나는 등록하지 않았어요!,Je ne me suis pas inscrit !,Ich habe mich nicht angemeldet!,Não me inscrevi!,ฉันไม่ได้ลงทะเบียนนะ！,"Saya tidak mendaftar, kan!",Tôi không đăng ký!
,,,,,,,,,,,,,,,,,,
AvgCommunicate_66999_Content_2,abZQ,avg通讯器聊天表_AvgCommunicate_A_M.csv,1116,AvgCommunicate,Content,哈姆林,录音时朵尔教授还提到，校方制作出了一款新型的录音机，体型小巧，音质细腻，甚至可以在出任务时随身携带，有录音和播放的功能。,"“During the recording session, Professor Doll also mentioned that the school had developed a new type of recorder. It is small in size, with clear audio quality, and can even be carried during missions, featuring both recording and playback functions.”","Во время записи профессор Дора упомянул, что администрация школы создала новую модель диктофона, компактную и с высоким качеством звука, которую можно носить с собой даже во время выполнения задач, с функциями записи и воспроизведения.","Mientras grababa, el profesor Muñeca mencionó que la escuela había fabricado un nuevo tipo de grabadora, pequeña y con calidad de sonido delicada, que incluso se puede llevar durante las misiones, con funciones de grabación y reproducción",録音時にドル教授は、校方が新しいタイプの録音機を制作したと述べました。その録音機は小型で、音質が細やかであり、任務中に持ち歩くこともできます。録音と再生の機能があります。,"녹음할 때 돌 교수는 핸드헬드 사이즈의 새로운 녹음기를 언급했습니다. 이 녹음기는 작고 음질이 섬세하며, 태스크 중에도 휴대 가능하고 녹음과 재생 기능을 갖추고 있습니다.","Lors de l'enregistrement, le professeur poupée a également mentionné que l'école avait fabriqué un nouveau type de dictaphone, de petite taille, avec un son délicat, pouvant même être porté lors de missions, avec des fonctions d'enregistrement et de lecture","Professor Puppe erwähnte während der Aufnahme, dass die Schule einen neuen Typ von Aufnahmegerät entwickelt hat, das klein ist, einen feinen Klang hat und sogar bei Einsätzen tragbar ist, mit Aufnahme- und Wiedergabefunktion","Enquanto gravava, a professora Boneca mencionou que a instituição criou um novo tipo de gravador, pequeno e com som detalhado, que pode ser levado em missões, com funções de gravação e reprodução",ขณะบันทึกเสียง ศาสตราจารย์ดอร์ได้กล่าวถึงเรื่องที่ทางมหาวิทยาลัยได้พัฒนาเครื่องบันทึกเสียงรุ่นใหม่ขึ้นมา ซึ่งมีขนาดเล็กกะทัดรัด คุณภาพเสียงละเอียด และสามารถพกพาติดตัวไปได้แม้ในระหว่างการปฏิบัติภารกิจ โดยมีฟังก์ชันในการบันทึกและเล่นเสียง.,"Saat merekam, Profesor Boneka juga menyebutkan bahwa pihak sekolah telah mengembangkan sebuah mesin perekam model baru. Mesin ini berukuran kecil, dengan kualitas suara yang jernih, bahkan dapat dibawa saat menjalankan misi. Alat tersebut memiliki fungsi rekaman dan pemutaran.","Trong quá trình ghi âm, Giáo sư đóa đã đề cập rằng trường đã chế tạo ra một loại máy ghi âm mới, có kích thước nhỏ gọn, âm thanh rõ nét và chi tiết, thậm chí có thể mang theo người khi thực hiện nhiệm vụ, có chức năng ghi âm và phát lại."
AvgCommunicate_66999_Content_3,abZR,avg通讯器聊天表_AvgCommunicate_A_M.csv,1117,AvgCommunicate,Content,哈姆林,我看到后就想到了你，如果需要的话，我可以为你录制你想听的乐曲。,"“When I saw it, I thought of you. If needed, I can make a record of the pieces you like to listen to.”","Увидев это, я вспомнил о тебе. Если тебе нужно, я могу записать для тебя музыку, которую ты хочешь послушать.","Pensé en ti cuando lo vi, y si lo necesitas, puedo grabar la música que quieres escuchar",私が見たらあなたを思い出しました。必要なら、あなたが聴きたい曲を録音することができます。,"나는 보고 당신을 생각했습니다. 필요해요, 당신이 듣고 싶은 곡을 녹음해드릴 수 있습니다.","Je pensais à toi en le voyant, si besoin, je peux enregistrer la musique que tu veux entendre","Ich dachte an dich, als ich es sah, wenn nötig, kann ich dir die Musik aufnehmen, die du hören möchtest","Assim que vi, pensei em você; se precisar, posso gravar as músicas que você gosta de ouvir",เมื่อฉันเห็นมัน ฉันก็คิดถึงคุณ ถ้าคุณอยากได้ ฉันสามารถบันทึกเพลงที่คุณอยากฟังให้คุณได้,"Setelah melihatnya, aku langsung teringat padamu. Jika kamu membutuhkannya, aku bisa merekam lagu yang ingin kamu dengar.","Tôi đã nghĩ đến bạn ngay khi thấy, nếu bạn muốn, tôi có thể ghi âm những bản nhạc mà bạn muốn nghe."
AvgCommunicate_66999_Content_4,abZS,avg通讯器聊天表_AvgCommunicate_A_M.csv,1118,AvgCommunicate,Content,哈姆林,这样即使有时我不在你的身边，也不会担心没有音乐来抚慰你的灵魂。,"“This way, even when I'm not by your side, you needn’t worry about lacking the music to soothe your soul.”","Так что даже когда меня иногда нет рядом с тобой, ты не будешь беспокоиться о том, что нет музыки, чтобы успокоить душу.","Así, incluso cuando a veces no esté a tu lado, no tendrás que preocuparte por la falta de música que consuele tu alma",こうすれば、私が時々あなたのそばにいなくても、音楽があなたのソウルをなぐさめるので心配する必要はありません。,이렇게 하면 내가 가끔 당신 곁에 있지 않아도 음악이 당신의 영혼을 위로하지 않을까 봐 걱정할 필요가 없습니다.,"Ainsi, même quand je ne suis pas près de toi, tu ne devras pas t'inquiéter de l'absence de musique pour apaiser ton âme","So wird es auch, wenn ich manchmal nicht bei dir bin, keine Sorge geben, dass dir die Musik fehlt, um deine Seele zu trösten","Assim, mesmo quando eu não estiver ao seu lado, você não precisará se preocupar em estar sem música para acalmar sua alma",แบบนี้แม้ว่าบางครั้งฉันจะไม่ได้อยู่ข้างๆ คุณ ก็ไม่ต้องกังวล เพราะยังมีดนตรีปลอบประโลมวิญญาณของคุณ。,"Jadi, meskipun terkadang aku tidak berada di sisimu, kamu tidak perlu khawatir karena musik akan tetap menenangkan jiwamu.","Như vậy, ngay cả khi đôi lúc tôi không ở bên cạnh bạn, bạn cũng sẽ không phải lo lắng về việc không có âm nhạc để xoa dịu linh hồn của bạn."
AvgCommunicate_66999_Option_5,acah,avg通讯器聊天表_AvgCommunicate_A_M.csv,1119,AvgCommunicate,Option,玩家,哈姆林……我好感动！,Hameln... I'm so moved!,Хамлин... Я так растроган.,¡Hameln... me siento tan conmovido!,ハムリン……感動しました！,함린…… 정말 감동적이야!,Hameln... je suis tellement touché !,Hameln... ich bin so berührt!,Hameln... estou tão emocionado!,แฮมลิน... ฉันซาบซึ้งมาก!,Hameln... aku sangat tersentuh!,Hamlin… Tôi rất cảm động!
AvgCommunicate_66999_Content_5,abZT,avg通讯器聊天表_AvgCommunicate_A_M.csv,1119,AvgCommunicate,Content,玩家,哈姆林……我好感动！,Hameln... I'm so moved!,Хамлин... Я так растроган.,¡Hameln... me siento tan conmovido!,ハムリン……感動しました！,함린…… 정말 감동적이야!,Hameln... je suis tellement touché !,Hameln... ich bin so berührt!,Hameln... estou tão emocionado!,แฮมลิน... ฉันซาบซึ้งมาก!,Hameln... aku sangat tersentuh!,Hamlin… Tôi rất cảm động!
AvgCommunicate_66999_Content_6,abZU,avg通讯器聊天表_AvgCommunicate_A_M.csv,1120,AvgCommunicate,Content,哈姆林,这都是我应尽的职责，那么，有什么想听的吗？,"It's simply part of my duty. Well then, is there anything you wish to listen to?","Это всё мои обязанности, так что, есть что-нибудь, что вы хотели бы послушать?","Esto son mis responsabilidades, así que, ¿hay algo que quieras escuchar?",これは私の務めですので、何か聞きたいことがありますか？,"이것은 제가 해야 할 의무입니다. 그렇다면, 듣고 싶은 것이 있나요?","C'est mon devoir, alors, y a-t-il quelque chose que vous souhaitez entendre ?","Das ist meine Pflicht, also gibt es etwas, das du hören möchtest?","Isso é tudo o que devo fazer, então, o que você gostaria de ouvir?",ทั้งหมดนี้เป็นหน้าที่ของฉัน แล้วคุณมีอะไรที่อยากฟังหรือเปล่า?,"Ini semua adalah tugasku. Lalu, apakah ada sesuatu yang ingin kamu dengar?","Đây đều là trách nhiệm của tôi, vậy, bạn có điều gì muốn nghe không?"
AvgCommunicate_66999_Option_7,acaj,avg通讯器聊天表_AvgCommunicate_A_M.csv,1121,AvgCommunicate,Option,玩家,有助睡眠的音乐,Soporific music.,Музыка для сна,Música que ayuda a dormir,睡眠を助ける音楽,수면에 도움이 되는 음악,Musique favorisant le sommeil,Musik zur Förderung des Schlafs,Música para ajudar a dormir,เพลงสำหรับการผ่อนคลายและนอนหลับ,Musik yang membantu tidur,Nhạc giúp ngủ ngon
AvgCommunicate_66999_Content_7,abZV,avg通讯器聊天表_AvgCommunicate_A_M.csv,1121,AvgCommunicate,Content,玩家,说起来，每次听你吹奏摇篮曲的时候，我都会睡得很好。,"“Speaking of which, I always sleep well whenever you perform the lullaby.”","Кстати, каждый раз, когда я слушаю, как ты играешь колыбельную, я прекрасно сплю.","Hablando de eso, cada vez que te escucho tocar la canción de cuna, duermo muy bien",そういえば、君がクレードルを吹いてくれるたびに、私はよく眠れるんだ。,"말해보면, 당신이 요람을 불러줄 때마다 나는 항상 잘 자게 돼요.","En parlant de cela, chaque fois que je t'entends jouer une berceuse, je m'endors très bien","Übrigens, jedes Mal, wenn ich dich Wiegenlieder spielen höre, schlafe ich sehr gut","Falando nisso, sempre durmo muito bem quando você toca a canção de ninar",พูดถึงเรื่องนี้ ทุกครั้งที่ได้ยินคุณเป่าเพลงกล่อมเด็ก ฉันมักจะนอนหลับได้อย่างสบายใจ,"Ngomong-ngomong, setiap kali mendengarmu memainkan lagu nina bobo, aku selalu tidur dengan nyenyak.","Nói đến việc mỗi lần nghe bạn hát nhạc ru, tôi đều ngủ rất ngon."
AvgCommunicate_66999_Content_8,abZW,avg通讯器聊天表_AvgCommunicate_A_M.csv,1122,AvgCommunicate,Content,玩家,这首曲子有什么特别的吗？,What's makes it so special?,Есть ли что-то особенное в этой мелодии?,¿Hay algo especial en esta melodía?,この曲には何か特別なところがありますか？,이 곡에 특별한 점이 있나요?,Cette pièce musicale a-t-elle quelque chose de spécial ?,Gibt es etwas Besonderes an diesem Stück Musik?,Esta música tem algo especial?,เพลงนี้มีอะไรพิเศษ?,Apakah ada yang spesial dari lagu ini?,Bài hát này có gì đặc biệt không?
AvgCommunicate_66999_Content_9,abZX,avg通讯器聊天表_AvgCommunicate_A_M.csv,1123,AvgCommunicate,Content,哈姆林,要这一首吗？我明白了。,You wish to hear that one? Understood.,Вот эта? Я понял.,¿Quieres esta canción? Lo entiendo,この曲を選びますか？わかりました。,이 노래를 원하세요? 알겠습니다.,Tu veux celle-ci ? J'ai compris,Möchtest du dieses Lied? Ich verstehe,Quer essa? Eu entendi,เอาเพลงนี้หรือเปล่า? ฉันเข้าใจแล้ว。,Apakah ini yang kamu maksud? Aku mengerti.,Bạn muốn bài này phải không?” Tôi hiểu rồi.
AvgCommunicate_66999_Content_10,abZL,avg通讯器聊天表_AvgCommunicate_A_M.csv,1124,AvgCommunicate,Content,哈姆林,如果非要说特别之处，大概是充满了我守护你的心情吧。,"If I must name what’s special about it, it must be because it’s brimming with my need to protect you. ","Если говорить о чем-то особенном, наверное, это полностью пронизано моим стремлением защищать тебя.","Si tengo que mencionar algo especial, probablemente sea que está lleno de mis sentimientos por protegerte",もし特別なところを言うなら、きっとあなたをガードしたいという気持ちで満ちていることでしょう。,"만약 특별한 점을 꼽자면, 아마도 당신을 수호하고 싶은 마음으로 가득 차 있기 때문이에요.","S'il fallait mentionner quelque chose de particulier, ce serait probablement l'émotion que j'éprouve en veillant sur toi","Wenn ich etwas Besonderes herausstellen müsste, dann wäre es wohl das Gefühl, dass ich dich beschütze","Se tivesse que dizer alguma particularidade, provavelmente seria repleta da emoção de eu estar te protegendo",ถ้าจะบอกว่ามีอะไรพิเศษ ก็คงเป็นเพราะเต็มไปด้วยความตั้งใจที่จะปกป้องคุณล่ะ,"Jika harus menyebutkan sesuatu yang istimewa, mungkin itu adalah perasaan penuh keinginan untuk melindungimu.","Nếu nhất định phải nói đến điểm đặc biệt, có lẽ chính là tình cảm mà tôi dành để bảo vệ bạn."
AvgCommunicate_66999_Option_11,acaa,avg通讯器聊天表_AvgCommunicate_A_M.csv,1125,AvgCommunicate,Option,玩家,帮助起床的音乐,Music that helps me get out of bed. ,"Музыка, помогающая проснуться",Música para despertar,起床を助ける音楽,기상 돕는 음악,Aide à la musique pour se lever,Hilfe beim Aufstehen,Música para ajudar a levantar,เพลงช่วยตื่นนอน,Musik untuk membantu bangun tidur,Nhạc giúp thức dậy
