,,,,,,,,,,,,,,,,,,
AvgCommunicate_66999_Content_11,abZM,avg通讯器聊天表_AvgCommunicate_A_M.csv,1125,AvgCommunicate,Content,玩家,其实我一直都有点起床困难，如果有那种令人振奋的音乐，起床应该会容易一些吧！,"“Actually, I’ve always had a bit of trouble getting up. If I had some rousing music, it would probable be easier to get out of bed!”","На самом деле, у меня всегда немного сложность с подъемом, если бы была какая-нибудь взбодряющая музыка, подниматься, наверное, было бы легче!","En realidad, siempre he tenido un poco de dificultad para levantarme. Si tuviera música estimulante, levantarme debería ser un poco más fácil, ¿verdad?",実は、いつも少し起きるのが難しいんです。もし元気になれる音楽があれば、起きるのも楽になるかもしれないですね！,"사실 저는 항상 조금 일어나기 어려움을 겪었어요. 만약 기분을 북돋아주는 음악이 있다면, 아침에 일어나는 것이 더 쉬울 거라고 생각해요.","En fait, j'ai un peu de mal à me lever, si j'avais une musique entraînante, ça devrait être plus facile de me lever !","Eigentlich habe ich immer ein wenig Schwierigkeiten, aufzustehen. Wenn es eine erfrischende Musik gäbe, wäre es vielleicht einfacher aufzustehen!","Na verdade, sempre tenho um pouco de dificuldade para levantar. Se houvesse aquela música estimulante, levantar seria mais fácil, não seria?",จริงๆ แล้วฉันมักจะตื่นนอนยากอยู่เสมอ ถ้ามีเพลงที่ทำให้รู้สึกฮึกเหิม การตื่นนอนคงจะง่ายขึ้นใช่ไหม!,"Sebenarnya aku selalu mengalami kesulitan untuk bangun, jika ada musik yang menggembirakan, bangun tentunya akan lebih mudah, bukan?!","Thực ra, tôi luôn có chút khó khăn khi thức dậy. Nếu có loại nhạc khiến người ta phấn chấn, việc thức dậy chắc sẽ dễ dàng hơn nhỉ!"
AvgCommunicate_66999_Content_12,abZN,avg通讯器聊天表_AvgCommunicate_A_M.csv,1126,AvgCommunicate,Content,哈姆林,令人振奋吗？我明白了。,“Rousing? Understood.”,Возбуждающе? Понял.,¿Es emocionante? Lo entiendo,興奮しますか？わかりました。,흥분되시나요? 알겠습니다.,"C'est excitant, n'est-ce pas ? Je comprends","Erfreulich, nicht wahr? Ich habe es verstanden","É emocionante, não? Eu entendi",น่าตื่นเต้นไหม? ผมเข้าใจแล้ว,Menggembirakan? Aku mengerti.,Có phấn khởi không? Tôi hiểu rồi.
AvgCommunicate_66999_Content_13,abZO,avg通讯器聊天表_AvgCommunicate_A_M.csv,1127,AvgCommunicate,Content,哈姆林,虽然我觉得充足良好的睡眠才是更重要的，但毕竟你肩负了如此多的责任，忙碌也是在所难免。,"“Even though I think it’s more important to get quality sleep, you shoulder such numerous burdens that business is unavoidable.”","Хотя я считаю, что достаточный и качественный сон важнее, но всё же у тебя на плечах столько ответственности, что занятость неизбежна.","Aunque creo que un buen sueño es lo más importante, después de todo, tienes tantas responsabilidades, la ocupación es inevitable",十分の睡眠が重要だとは思うが、あなたは多くの責任を担っており、忙しいのもやむを得ないだろう。,"Although I think sufficient and good sleep is more important, since you bear so many responsibilities, being busy is inevitable.","Bien que je pense qu'un sommeil suffisant et de qualité est plus important, tu portes tant de responsabilités, il est inévitable d'être occupé","Obwohl ich denke, dass ausreichender Schlaf wichtiger ist, trägst du schließlich so viele Verpflichtungen, ist es unvermeidlich, beschäftigt zu sein","Embora eu ache que ter um sono bom e adequado seja mais importante, você tem tantas responsabilidades, estar ocupado é inevitável",แม้ว่าฉันจะคิดว่าการนอนหลับที่เพียงพอและมีคุณภาพดีนั้นสำคัญกว่า แต่ในเมื่อคุณแบกรับความรับผิดชอบมากมาย การยุ่งจนแทบไม่มีเวลาพักก็คงจะเป็นเรื่องที่หลีกเลี่ยงไม่ได้,"Meskipun saya merasa tidur yang cukup dan berkualitas lebih penting, namun karena kamu memiliki begitu banyak tanggung jawab, kesibukan memang tidak terhindarkan.","Mặc dù tôi nghĩ rằng giấc ngủ đầy đủ và chất lượng là điều quan trọng hơn, nhưng vì bạn đã gánh vác nhiều trách nhiệm như vậy, bận rộn là điều khó tránh."
AvgCommunicate_66999_Content_14,abZP,avg通讯器聊天表_AvgCommunicate_A_M.csv,1128,AvgCommunicate,Content,哈姆林,希望这首进行曲能够带给你力量。,“May this march lend you strength!”,"Надеюсь, этот марш придаст тебе силы.",Espero que esta marcha pueda darte fuerzas,この進行曲があなたにパワーをもたらすことを願っています。,이 행진곡이 당신에게 힘을 줄 수 있기를 바랍니다.,J'espère que cette marche militaire pourra te donner de la force,"Ich hoffe, dieser Marsch gibt dir Kraft",Espero que esta marcha te traga poder,หวังว่าเพลงมาร์ชนี้จะมอบพละกำลังให้กับคุณ。,Semoga lagu mars ini dapat memberikanmu kekuatan.,Hy vọng bản hành khúc này sẽ mang lại sức mạnh cho bạn.
,,,,,,,,,,,,,,,,,,
AvgCommunicate_67000_Content_1,acam,avg通讯器聊天表_AvgCommunicate_A_M.csv,1771,AvgCommunicate,Content,哈姆林,%player%%sirormadam%，最近我又创作了一首新的曲子，想请你在闲暇时间来点评一二。,"{Male=Mr.,Female=Miss} %player%, “Recently, I've composed a new piece and would like to invite you to give it a listen and critique in your free time.”","%player%%sirormadam%, недавно я сочинил новую мелодию и хотел бы попросить вас в свободное время оценить её.","%player%%sirormadam%，recientemente he creado una nueva canción, me gustaría que la comentaras en tu tiempo libre",%player%%sirormadam%、最近また新しい曲を作りました。暇なときに感想を聞かせてもらえませんか。,"%player%%sirormadam%, 최근에 새로운 곡을 하나 만들었는데, 여유 시간에 들려주시고 평가를 부탁드립니다.","%player%%sirormadam%， récemment, j'ai composé une nouvelle musique et j'aimerais que tu donnes ton avis quand tu as du temps libre","%player%%sirormadam%， kürzlich habe ich ein neues Stück komponiert und möchte dich bitten, es in deiner Freizeit zu kommentieren","%player%%sirormadam%, recentemente criei uma nova música e gostaria que você a comentasse em seu tempo livre",%player%%sirormadam%，ช่วงนี้ฉันได้สร้างสรรค์เพลงใหม่อีกแล้ว อยากให้คุณมาช่วยดูให้หน่อยในเวลาว่าง,%player%%sirormadam%，akhir-akhir ini saya telah menciptakan sebuah komposisi baru dan ingin mengundang Anda untuk memberikan beberapa masukan di waktu senggang Anda.,"%player%%sirormadam%,gần đây tôi đã sáng tác một bài hát mới, muốn mời bạn dành thời gian rảnh rỗi bình luận giúp tôi một chút."
AvgCommunicate_67000_Option_2,acaC,avg通讯器聊天表_AvgCommunicate_A_M.csv,1772,AvgCommunicate,Option,玩家,你真是太客气了。,You really are too polite.,Вы очень любезны.,Eres realmente muy cortés,本当にありがとうございます。,너 정말 고마워.,Tu es vraiment trop poli,Du bist wirklich zu höflich,Você é realmente muito educado,คุณสุภาพมาก,Kamu benar-benar sangat ramah.,Bạn thật là tử tế.
AvgCommunicate_67000_Content_2,acaq,avg通讯器聊天表_AvgCommunicate_A_M.csv,1772,AvgCommunicate,Content,玩家,你真是太客气了，哈姆林，我这种半吊子哪有资格来点评你的作品啊。,"“You're too kind, Hameln,. How can a half-baked amateur like me be qualified to critique your work?”","Вы слишком вежливы, Хамлин, какой у меня, любителя, право оценивать вашу работу.","Eres realmente muy cortés, Hameln, ¿cómo podría un aficionado como yo comentar sobre tu trabajo?",あなたは本当に丁寧ですね、ハムリン。私みたいな半端者に、あなたの作品を評価する資格なんてありませんよ。,"너 정말 너무 겸손해, 함린. 나 같은 반쪽짜리가 당신의 작품을 평가할 자격이 어디 있어.","Tu es vraiment trop poli, Hameln, je ne suis qu'un amateur, je n'ai pas le droit de donner un avis sur ton travail","Du bist wirklich zu höflich, Hameln, ich habe nicht das Recht, dein Werk zu beurteilen","Você é realmente muito educado, Hameln, eu, como um amador, não tenho qualificação para comentar sobre seu trabalho",คุณสุภาพเกินไปแล้ว แฮมลิน ฉันที่เป็นแค่มือสมัครเล่นจะไปมีสิทธิ์อะไรมาวิจารณ์ผลงานของคุณได้ล่ะ,"Kamu terlalu sopan, Hameln. Seseorang seperti aku yang hanya setengah-setengah mana mungkin punya hak untuk menilai karyamu.","Anh thật là khiêm tốn, Hamlin. Tôi chỉ là kẻ nghiệp dư, làm sao đủ tư cách để nhận xét tác phẩm của anh được."
AvgCommunicate_67000_Content_3,acar,avg通讯器聊天表_AvgCommunicate_A_M.csv,1773,AvgCommunicate,Content,哈姆林,不，不必妄自菲薄，你的建议是我创作最大的动力。,"“No, don’t downplay your significance; your suggestions are my greatest source of creative motivation.”","Нет, не стоит недооценивать себя, твои предложения вдохновляют меня больше всего.","No, no te menosprecies, tus sugerencias son la mayor motivación para mi creación",いいえ、卑下することはありません。あなたの提案が私の創作活動の最大の動力です。,"아니요, 자신을 낮추지 마세요. 당신의 제안이 저의 창작의 가장 큰 동력입니다.","Non, tu ne dois pas être trop modeste, tes suggestions sont ma plus grande inspiration dans la création","Nein, du solltest nicht über dich selbst herziehen, dein Vorschlag ist meine größte Motivation zum Schaffen","Não, não se menospreze, suas sugestões são minha maior motivação para criar",ไม่เลย อย่าดูถูกตัวเอง คำแนะนำของคุณเป็นแรงบันดาลใจสำคัญที่สุดสำหรับการสร้างสรรค์ผลงานของฉัน,"Tidak, jangan meremehkan dirimu sendiri. Saranmu adalah sumber motivasi terbesar bagi kreativitasku.","Không, đừng đánh giá thấp bản thân một cách không cần thiết, đề xuất của bạn là động lực lớn nhất cho tôi sáng tạo."
AvgCommunicate_67000_Option_4,acaE,avg通讯器聊天表_AvgCommunicate_A_M.csv,1774,AvgCommunicate,Option,玩家,有这么夸张吗？,Really?,Неужели это так ужасно?,¿Es tan exagerado?,それほど大げさですか？,이렇게 과장되나요?,Est-ce vraiment si exagéré ?,Ist das wirklich so übertrieben?,É tão exagerado assim?,มันเกินจริงขนาดนั้นเลยหรือไหม,Apakah benar-benar se-exaggerated itu?,Có đến mức đó sao?
AvgCommunicate_67000_Content_4,acas,avg通讯器聊天表_AvgCommunicate_A_M.csv,1774,AvgCommunicate,Content,玩家,有这么夸张吗？不过，虽然很不好意思说，其实我每次听你新作的曲子都会听睡着……,"“Really? Because I must shamefully admit, however, that I always fall asleep while listening to your new compositions...”","Настолько ли это преувеличено? Однако, хотя мне и неловко это говорить, но каждый раз, когда я слушаю твои новые произведения, я начинаю дремать..","¿Es tan exagerado? Sin embargo, aunque me da un poco de vergüenza decirlo, cada vez que escucho una nueva canción tuya, ¡me duermo",そんなに大げさですか？でも、恥ずかしいですが、実はあなたの新しい曲を聞くたびに眠ってしまう……,"이렇게까지 과장되나? 하지만, 좀 부끄럽지만 사실 당신의 새로운 곡을 들을 때마다 잠이 들어버려요…","Est-ce vraiment si exagéré ? Mais, bien que ce soit embarrassant à dire, en fait, chaque fois que j'écoute tes nouvelles compositions, je finis par m'endormir","Ist das wirklich so übertrieben? Aber, auch wenn es mir leid tut zu sagen, ich schlafe tatsächlich jedes Mal ein, wenn ich deine neuen Stücke höre","É tão exagerado assim? Mas, embora eu esteja envergonhado em dizer isso, na verdade, sempre acabo dormindo ao ouvir suas novas composições",มันเว่อร์ขนาดนั้นเลยเหรอ? แต่ถึงแม้จะรู้สึกเขินที่จะพูด จริงๆ แล้วทุกครั้งที่ฉันฟังเพลงใหม่ของคุณ ฉันมักจะหลับไปตอนฟัง..,"Apa benar se-exaggerated begitu? Namun, meskipun agak malu untuk mengatakannya, sebenarnya setiap kali aku mendengarkan lagu baru yang kamu buat, aku selalu tertidur…","Có phải vậy không? Tuy nhiên, mặc dù rất ngại nói, nhưng thực tế là mỗi lần nghe bài hát mới của bạn tôi đều nghe đến ngủ quên"
AvgCommunicate_67000_Content_5,acat,avg通讯器聊天表_AvgCommunicate_A_M.csv,1775,AvgCommunicate,Content,玩家,你的曲子是很优美，演奏也无可挑剔，就是每次我都像着了魔一样很快就睡晕过去了，可能我真的没有什么音乐天赋吧。,"“Your music is hauntingly beautiful and flawlessly performed, yet it casts some sedative magic on me and I fall asleep instantly. Perhaps I truly lack a musical ear.”","Ваша музыка очень красива, исполнение безупречно, просто каждый раз я почти мгновенно засыпаю, словно околдованный. Наверное, у меня действительно нет музыкального таланта.","Tu pieza es hermosa, la interpretación es impecable, solo que cada vez que la escucho, me quedo dormido casi inmediatamente, tal vez realmente no tengo talento musical",あなたの曲はとても美しく、演奏も完璧ですが、毎回私はまるで魔法にかかったようにすぐに眠気を催してしまいます。きっと私は音楽の才能がないのでしょう。,"당신의 곡은 매우 아름답고, 연주도 흠잡을 데 없지만, 매번 제가 마치 마법에 걸린 것처럼 혼미해져서 잠이 듭니다. 아마도 제게는 정말 음악 재능이 없는 것 같아요.","Ta mélodie est belle, ton interprétation impeccable, mais je m'endors très vite à chaque fois comme si j'étais ensorcelé, peut-être que je n'ai vraiment aucun talent musical","Dein Stück ist sehr schön, die Aufführung ist tadellos, aber jedes Mal schlafe ich wie verzaubert sehr schnell ein, vielleicht habe ich wirklich kein musikalisches Talent","Sua música é muito bonita, a execução é impecável, mas sempre que escuto, eu rapidamente adormeço como se estivesse sob um feitiço, talvez eu realmente não tenha talento musical",เพลงของเธอก็ไพเราะดีนะ การบรรเลงก็ไม่มีที่ติ แต่ทุกครั้งฉันกลับเหมือนโดนสะกดจนเผลอหลับไปโดยไม่รู้ตัว อาจจะเป็นเพราะฉันไม่มีพรสวรรค์ทางดนตรีจริงๆ ก็ได้,"Lagumu memang sangat indah, dan penampilanmu juga tanpa cela. Namun, setiap kali aku mendengarnya, aku seperti terhipnotis dan langsung tertidur tak lama kemudian. Mungkin aku benar-benar tidak memiliki bakat musik.","Bản nhạc của bạn rất đẹp, cách chơi cũng không có gì để chê trách. Chỉ là mỗi lần nghe, tôi đều như bị mê hoặc và nhanh chóng thiếp đi. Có lẽ tôi thực sự không có tài năng âm nhạc."
AvgCommunicate_67000_Content_6,acau,avg通讯器聊天表_AvgCommunicate_A_M.csv,1776,AvgCommunicate,Content,哈姆林,不，这正是我想要的。,"“No, that is exactly what I want.”","Нет, это именно то, что я хотел.","No, eso es exactamente lo que quería",いいえ、これこそが私が欲しかったものです。,"아니요, 이거야말로 제가 원하던 것입니다.","Non, c'est exactement ce que je voulais","Nein, das ist genau das, was ich wollte","Não, é exatamente isso que eu queria",ไม่ นี่คือสิ่งที่ฉันต้องการพอดี。,"Tidak, ini memang apa yang aku inginkan.","Không, đây chính là điều tôi muốn."
AvgCommunicate_67000_Content_7,acav,avg通讯器聊天表_AvgCommunicate_A_M.csv,1777,AvgCommunicate,Content,哈姆林,能为你带来安眠，正是我的使命与职责。,Being able to bring you restful sleep is my mission and duty.,Моя миссия и обязанность — дарить вам спокойный сон.,Mi misión es traerle paz y sueño,あなたに安眠をもたらすことが、私の使命であり責任です。,편안한 잠을 가져다주는 것이 바로 제 사명과 의무입니다.,"Apporter un sommeil paisible, c'est ma mission et mon devoir","Es ist meine Mission und Pflicht, dir einen erholsamen Schlaf zu bringen",Ajudar você a ter um sono tranquilo é a minha missão e dever,การมอบความสงบสุขให้คุณคือหน้าที่อันทรงเกียรติและภารกิจของฉัน,Membawakanmu tidur nyenyak adalah misi dan tugas saya.,"Mang lại giấc ngủ yên bình cho bạn, chính là sứ mệnh và trách nhiệm của tôi."
AvgCommunicate_67000_Content_8,acaw,avg通讯器聊天表_AvgCommunicate_A_M.csv,1778,AvgCommunicate,Content,哈姆林,不如说，请你具体描述不同曲子为你带来的感受，以及听完后的睡眠质量，入睡的速度和睡眠时长等等。,"“Rather, please describe in detail the feelings that different pieces bring you, as well as your post-listening sleep quality, how long it takes to fall asleep, and the duration of your sleep, etc.”","Скорее, опиши конкретно, какие чувства вызывают у тебя разные мелодии, а также качество сна после прослушивания, скорость засыпания и продолжительность сна и так далее.","Más bien, por favor describe en detalle cómo diferentes piezas te hacen sentir y la calidad de sueño después de escucharlas, la velocidad de conciliar el sueño y la duración del sueño, etc",むしろ、異なる曲がもたらす具体的な感情や、聴いた後の睡眠の質、入眠の速さ、睡眠時間などを詳しく説明してください。,"오히려 다양한 곡들이 당신에게 어떤 감정을 주었는지, 그리고 듣고 난 후의 수면 질, 잠에 드는 속도와 수면 시간 등을 구체적으로 설명해 주세요.","Mieux vaut que tu décrives spécifiquement les sensations que chaque morceau t'apporte, ainsi que la qualité de ton sommeil après l'écoute, le temps qu'il te faut pour t'endormir et la durée de ton sommeil, etc","Oder besser, bitte beschreibe konkret, welche Gefühle dir verschiedene Stücke bringen und wie die Schlafqualität, das Einschlafen und die Schlafdauer nach dem Hören sind","Na verdade, descreva especificamente como diferentes músicas trazem sensações para você e a qualidade do seu sono após ouvi-las, como a rapidez para adormecer e a duração do sono, etc",หรืออธิบายอย่างละเอียดว่าแต่ละเพลงทำให้คุณรู้สึกอย่างไร รวมถึงคุณภาพการนอนหลับ ความเร็วในการหลับ และระยะเวลาการนอนเป็นต้น,"Sebaiknya, jelaskan secara spesifik perasaan yang muncul saat mendengarkan melodi yang berbeda, serta kualitas tidur setelah mendengarkannya, kecepatan untuk tertidur, dan durasi tidur, dan sebagainya.","Hãy mô tả cụ thể hơn về cảm nhận của bạn khi nghe các bản nhạc khác nhau, và chất lượng giấc ngủ, tốc độ đi vào giấc ngủ và thời gian ngủ sau khi nghe."
AvgCommunicate_67000_Content_10,acan,avg通讯器聊天表_AvgCommunicate_A_M.csv,1780,AvgCommunicate,Content,哈姆林,啊，这样的要求确实有些苛刻，是我考虑不周。,"“Ah, such requests are rather austere. My apologies for being inconsiderate.”","Ах, такие требования действительно довольно суровы, это моя недоработка.","¡Ah, esta solicitud es un poco excesiva, no pensé con cuidado!",あ、そんな要求は確かに厳しいですね。私の考えが足りませんでした。,"아, 이런 요구사항은 확실히 좀 까다롭네요, 제 고려가 부족했습니다.","Ah, une telle demande est effectivement un peu excessive, c'est moi qui n'ai pas bien réfléchi","Ah, such a request is indeed a bit harsh; it was my oversight","Ah, esse pedido é um pouco severo, sou eu que não pensei bem",อา ข้อเรียกร้องแบบนี้ค่อนข้างเข้มงวด ดูเหมือนว่าฉันจะพิจารณาไม่รอบคอบ,"Ah, permintaan seperti itu memang agak berat. Ini kesalahan saya karena kurang mempertimbangkan.","À, yêu cầu như vậy quả thực có phần khắt khe, là do tôi đã không cân nhắc kỹ lưỡng."
AvgCommunicate_67000_Content_11,acao,avg通讯器聊天表_AvgCommunicate_A_M.csv,1781,AvgCommunicate,Content,哈姆林,不如下次就让我在你的床前演奏，让我来细致记录你的睡眠吧。,How about next time I play by your bedside and you allow me to observe and record your sleep.,"Может быть, в следующий раз я сыграю у твоей кровати и подробно опишу твой сон.","La próxima vez, ¿por qué no toco cerca de tu cama? Déjame registrar tus sueños con detalle",次回はあなたのベッドの前で演奏させてください、あなたの睡眠を細かく記録させてください。,다음에는 네 침대 앞에서 연주하게 해줘. 네 수면을 자세히 기록할게.,"Pourquoi ne pas me laisser jouer devant ton lit la prochaine fois, afin que je puisse enregistrer soigneusement ton sommeil ?","Wie wäre es, wenn ich das nächste Mal an deinem Bett spiele und deine Schlafqualität, Einschlafgeschwindigkeit und Schlafdauer detailgenau aufzeichne?",Por que não me deixa tocar na sua cama da próxima vez? Vou registrar seu sono com detalhes,หรือครั้งหน้าให้ฉันบรรเลงเพลงข้างเตียงของคุณดีกว่า แล้วฉันจะจดบันทึกการพักผ่อนของคุณอย่างละเมียดละไมนะ,Bagaimana kalau lain kali aku memainkan musik di samping tempat tidurmu dan mencatat tidurmu secara detail?,"Hay để lần sau tôi đàn cho bạn ngay trước giường, và quan sát giấc ngủ của bạn một cách nhẹ nhàng nhé."
AvgCommunicate_67000_Content_12,acap,avg通讯器聊天表_AvgCommunicate_A_M.csv,1782,AvgCommunicate,Content,哈姆林,我希望你的每一次入睡，都有我的守候。,I hope you fall asleep every time under my protection.,"Я хочу, чтобы каждый раз, когда ты засыпаешь, я был рядом и охранял твой сон.","Espero que cada vez que duermas, tenga mi compañía",あなたの毎回の就寝時、私の見守りがありますように。,나는 당신이 잠드는 매 순간에 내 곁에 있어주기를 바랍니다.,": J'espère que chaque fois que tu t'endors, je serai là en train de veiller sur toi","Ich hoffe, dass du bei jedem Einschlafen auf mich warten wirst","Espero que em cada um dos seus sonhos, eu esteja ao seu lado",ฉันหวังว่าทุกครั้งที่คุณหลับตา จะมีฉันคอยอยู่เคียงข้าง,"Saya harap setiap kali kamu tidur, aku selalu ada untuk menjaga.","Tôi mong rằng mỗi lần bạn chìm vào giấc ngủ, đều có sự hiện diện của tôi bên cạnh."
